category,text
negative,"Changes in gene expression in the permissive larval host lightbrown apple moth (Epiphyas postvittana, Tortricidae) in response to EppoNPV (Baculoviridae) infection. Host cell and virus gene expression were measured five days after per os inoculation of 3rd instar lightbrown apple moth (LBAM) larvae with the Epiphyas postvittana nucleopolyhedrovirus (EppoNPV). Microarray analysis identified 84 insect genes that were up-regulated and 18 genes that were down-regulated in virus-infected larvae compared with uninfected larvae. From the 134 viral open reading frames represented on the microarray, 81 genes showed strong expression. Of the 38 functionally identifiable regulated insect genes, 23 coded for proteins that have roles in one of five processes; regulation of transcription and translation, induction of apoptosis, and maintenance of both juvenility and actin cytoskeletal integrity. Of the 34 functionally identifiable viral genes that were most strongly expressed, 12 had functions associated with these five processes, as did a further seven viral genes which were expressed at slightly lower levels. A survey of the LBAM-expressed sequence tag library identified further genes involved in these processes. In total, 135 insect genes and 38 viral genes were analysed by quantitative polymerase chain reaction. Twenty-one insect genes were strongly up-regulated and 31 genes strongly down-regulated. All 38 viral genes examined were highly expressed. These data suggest that induction of apoptosis and regulation of juvenility are the major 'battlegrounds' between virus and insect, with the majority of changes observed representing viral control of insect gene expression. Transcription and translational effects seem to be exerted largely through modulation of mRNA and protein degradation. Examples of attempts by the insect to repel the infection via changes in gene expression within these same processes were, however, also noted. The data also showed the extent to which viral transcription dominated in the infected insects at five days post inoculation. "
positive,"Functional characterization of odorant-binding proteins from the scarab beetle Holotrichia oblita based on semiochemical-induced expression alteration and gene silencing. With the advent of next-generation sequencing, it is now possible to rapidly identify the entire repertoire of olfactory genes likely to be involved in chemical communication of an insect species. It remains, however, a challenge to identify olfactory proteins, such as odorant receptors and odorant-binding proteins (OBPs), vis-à-vis the odorants they detect. It has been reported that exposing the olfactory system to a physiologically relevant odorant alters the transcript levels of odorant receptor(s) involved in the detection of the tested odorant. We applied this paradigm in an attempt to identify putative OBPs from the scarab beetle Holotrichia oblita involved in the reception of plant-derived kairomones. Twenty-nine OBP genes were identified in the H. oblita transcriptome, 20 of which were enriched in antennae compared with nonolfactory tissues. Of these, 2 OBP genes, HoblOBP13 and HoblOBP9, were upregulated upon exposure to one of the female attractants (E)-2-hexenol and phenethyl alcohol; none of the OBP transcripts changed upon exposure to methyl anthranilate, which does not attract H. oblita females. Binding assays showed that HoblOBP13 and HoblOBP9 have high affinity for (E)-2-hexenol and phenethyl alcohol, respectively. RNAi treatment showed that transcripts of both HoblOBP13 and HoblOBP9 declined in a time-course manner 24-72 h postinjection. OBP-dsRNA-treated female beetles showed significantly lower attraction to (E)-2-hexenol and phenethyl alcohol than did water-injected beetles and those treated with GFP-dsRNA. We, therefore, concluded that HoblOBP13 and HoblOBP9 are essential for H. oblita reception of the plant-derived kairomones (E)-2-hexenol and phenethyl alcohol. "
negative,"Identification of odorant-binding proteins of the yellow fever mosquito Aedes aegypti: genome annotation and comparative analyses. The yellow fever mosquito Aedes aegypti is an important human health pest which vectors yellow fever and dengue viruses. Olfaction plays a crucial role in its attraction to hosts and although the molecular basis of this is not well understood it is likely that odorant-binding proteins (OBPs) are involved in the first step of molecular recognition. Based on the OBPs of Drosophila melanogaster and Anopheles gambiae we have defined sequence motifs based on OBP conserved cysteine and developed an algorithm which has allowed us to identify 66 genes encoding putative OBPs from the genome sequence and expressed sequence tags (ESTs) of Ae. aegypti. We have also identified 11 new OBP genes for An. gambiae. We have examined all of the corresponding peptide sequences for the properties of OBPs. The predicted molecular weights fall within the expected range but the predicted isoeletric points are spread over a wider range than found previously. Comparative analyses of the 66 OBP sequences of Ae. aegypti with other dipteran species reveal some mosquito-specific genes as well as conserved homologues. The genomic organisation of Ae. aegypti OBPs suggests that a rapid expansion of OBPs has occurred, probably by gene duplication. The analyses of OBP-containing regions for microsynteny indicate a very high synteny between Ae. aegypti and An. gambiae. "
negative,"Annotated Draft Genomes of Two Caddisfly Species Plectrocnemia conspersa CURTIS and Hydropsyche tenuis NAVAS (Insecta: Trichoptera). Members of the speciose insect order Trichoptera (caddisflies) provide important ecosystem services, for example, nutrient cycling through breaking down of organic matter. They are also of industrial interest due to their larval silk secretions. These form the basis for their diverse case-making behavior that allows them to exploit a wide range of ecological niches. Only five genomes of this order have been published thus far, with variable qualities regarding contiguity and completeness. A low-cost sequencing strategy, that is, using a single Oxford Nanopore flow cell per individual along with Illumina sequence reads was successfully used to generate high-quality genomes of two Trichoptera species, Plectrocnemia conspersa and Hydropsyche tenuis. Of the de novo assembly methods compared, assembly of low coverage Nanopore reads (∼18×) and subsequent polishing with long reads followed by Illumina short reads (∼80-170× coverage) yielded the highest genome quality both in terms of contiguity and BUSCO completeness. The presented genomes are the shortest to date and extend our knowledge of genome size across caddisfly families. The genomic region that encodes for light (L)-chain fibroin, a protein component of larval caddisfly silk was identified and compared with existing L-fibroin gene clusters. The new genomic resources presented in this paper are among the highest quality Trichoptera genomes and will increase the knowledge of this important insect order by serving as the basis for phylogenomic and comparative genomic studies. "
positive,"The AmCREB gene is an ortholog of the mammalian CREB / CREM family of transcription factors and encodes several splice variants in the honeybee brain. The transcription factor CREB (cAMP response element binding protein) is required for the switch from short-term to long-term synaptic plasticity and from short-term to long-term memory. Its activity is regulated by the cAMP-dependent signalling cascade, which has been shown to play a crucial role in the honeybee's long-term memory formation. To elucidate the role of the CREB in honeybee memory formation we analysed a CREB-homologous gene, AmCREB, which is expressed as several transcripts in the honeybee brain. Eight transcripts have been identified (AmCREB 1-8) that are generated by alternate splicing. One antibody generated against a subset of these variants reveals a cytosolic localization in the mushroom body alpha-lobes, the glomeruli of the antennal lobes, the protocerebral lobes, the central complex and in the optical lobes. "
negative,"Recombination is associated with the evolution of genome structure and worker behavior in honey bees. The rise of insect societies, marked by the formation of reproductive and sterile castes, represents a major unsolved mystery in evolution. Across several independent origins of sociality, the genomes of social hymenopterans share two peculiar attributes: high recombination and low but heterogeneous GC content. For example, the genome of the honey bee, Apis mellifera, represents a mosaic of GC-poor and GC-rich regions with rates of recombination an order of magnitude higher than in humans. However, it is unclear how heterogeneity in GC content arises, and how it relates to the expression and evolution of worker traits. Using population genetic analyses, we demonstrate a bias in the allele frequency and fixation rate of derived C or G mutations in high-recombination regions, consistent with recombination's causal influence on GC-content evolution via biased gene conversion. We also show that recombination and biased gene conversion actively maintain the heterogeneous GC content of the honey bee genome despite an overall A / T mutation bias. Further, we found that GC-rich genes and intergenic regions have higher levels of genetic diversity and divergence relative to GC-poor regions, also consistent with recombination's causal influence on the rate of molecular evolution. Finally, we found that genes associated with behavior and those with worker-biased expression are found in GC-rich regions of the bee genome and also experience high rates of molecular evolution. Taken together, these findings suggest that recombination acts to maintain a genetically diverse and dynamic part of the genome where genes underlying worker behavior evolve more quickly. "
negative,"From development to biodiversity--Tribolium castaneum, an insect model organism for short germband development. Insect embryogenesis is best understood in the fruit fly Drosophila. However, Drosophila embryogenesis shows evolutionary-derived features: anterior patterning is controlled by a highly derived Hox gene bicoid, the body segments form almost simultaneously and appendages develop from imaginal discs. In contrast, embryogenesis of the red flour beetle Tribolium castaneum displays typical features in anterior patterning, axis and limb formation shared with most insects, other arthropods as well as with vertebrates. Anterior patterning depends on the conserved homeobox gene orthodenticle, the main body axis elongates sequentially and limbs grow continuously starting from an appendage bud. Thus, by analysing developmental processes in the beetle at the molecular and cellular level, inferences can be made for similar processes in other arthropods. With the completion of sequencing the Tribolium genome, the door is now open for post-genomic studies such as RNA expression profiling, proteomics and functional genomics to identify beetle-specific gene circuits. "
negative,"Genomic dissection of behavioral maturation in the honey bee. Honey bees undergo an age-related, socially regulated transition from working in the hive to foraging that has been previously associated with changes in the expression of thousands of genes in the brain. To understand the meaning of these changes, we conducted microarray analyses to examine the following: (i) the ontogeny of gene expression preceding the onset of foraging, (ii) the effects of physiological and genetic factors that influence this behavioral transition, and (iii) the effects of foraging experience. Although >85% of approximately 5,500 genes showed brain differences, principal component analysis revealed discrete influences of age, behavior, genotype, environment, and experience. Young bees not yet competent to forage showed extensive, age-related expression changes, essentially complete by 8 days of age, coinciding with previously described structural brain changes. Subsequent changes were not age-related but were largely related to effects of juvenile hormone (JH), suggesting that the increase in JH that influences the hive bee-forager transition may cause many of these changes. Other treatments that also influence the onset age of foraging induced many changes but with little overlap, suggesting that multiple pathways affect behavioral maturation. Subspecies differences in onset age of foraging were correlated with differences in JH and JH-target gene expression, suggesting that this endocrine system mediates the genetic differences. We also used this multifactorial approach to identify candidate genes for behavioral maturation. This successful dissection of gene expression indicates that, for social behavior, gene expression in the brain can provide a robust indicator of the interaction between hereditary and environmental information. "
negative,"Chromosome Painting in Triatomine Insects Reveals Shared Sequences Between X Chromosomes and Autosomes. In order to provide a broad picture on the origin and evolution of holocentric X chromosomes in heteropteran species, we prepared a sex chromosome painting probe by microdissection of the X1 and X2 chromosomes from a kissing bug Mepraia spinolai (Hemiptera: Reduviidae: Triatominae). Fluorescence in situ hybridization on four species of the Triatomini having different amounts of autosomal heterochromatin and sex chromosome systems show that the Xs probe hybridizes on the euchromatin, located both on autosomes and X chromosomes. The heterochromatic Y chromosome and autosomal heterochromatic regions always appear free of hybridization signals. The hybridization results of the Xs probe on Rhodnius prolixus (Rhodniini) is completely different to that observed in Triatomini species. The hybridization signals are small and scattered on all euchromatin, without specific regions including the X chromosome. These results are in accordance with previous data obtained by genomic in situ hybridization and fluorescent banding, suggesting a clear differentiation in the repeat sequence composition of both sex chromosomes between Triatomini and Rhodniini tribes. These results also support that each sex chromosome in Triatomini has evolved independently from different autosomal pairs of a common ancestor, as described in other insect orders. "
negative,"Genomes of Diptera. Diptera (true flies) are among the most diverse holometabolan insect orders and were the first eukaryotic order to have a representative genome fully sequenced. 110 fly species have publically available genome assemblies and many hundreds of population-level genomes have been generated in the model organisms Drosophila melanogaster and the malaria mosquito Anopheles gambiae. Comparative genomics carried out in a phylogenetic context is illuminating many aspects of fly biology, providing unprecedented insight into variability in genome structure, gene content, genetic mechanisms, and rates and patterns of evolution in genes, populations, and species. Despite the rich availability of genomic resources in flies, there remain many fly lineages to which new genome sequencing efforts should be directed. Such efforts would be most valuable in fly families or clades that exhibit multiple origins of key fly behaviors such as blood feeding, phytophagy, parasitism, pollination, and mycophagy. "
negative,"Genomic and transcriptional analysis of protein heterogeneity of the honeybee venom allergen Api m 6. Several components of honeybee venom are known to cause allergenic responses in humans and other vertebrates. One such component, the minor allergen Api m 6, has been known to show amino acid variation but the genetic mechanism for this variation is unknown. Here we show that Api m 6 is derived from a single locus, and that substantial protein-level variation has a simple genome-level cause, without the need to invoke multiple loci or alternatively spliced exons. Api m 6 sits near a misassembled section of the honeybee genome sequence, and we propose that a substantial number of indels at and near Api m 6 might be the root cause of this misassembly. We suggest that genes such as Api m 6 with coding-region or untranslated region indels might have had a strong effect on the assembly of this draft of the honeybee genome. "
negative,"Amplifying whole insect genomes with multiple displacement amplification. Many applications in insect genetics require repeated analyses on individual organisms. These include population genetic and genomics, linkage mapping, molecular systematics and map-based positional cloning. However, using the polymerase chain reaction, a limited number of analyses are possible with DNA isolated from whole bodies or parts of small or preserved specimens. We describe the optimization of a new technique, Multiple Displacement Amplification, for 100-400-fold amplification of whole mosquito genomes. We demonstrate that MDA amplifies genomic DNA directly from an adult leg or from organisms as small as a first instar mosquito larva. Genetic polymorphisms revealed at individual loci are the same whether using the original genomic DNA or MDA DNA as a template. "
negative,"Genome-wide analysis of differential mRNA expression of Amsacta moorei entomopoxvirus, mediated by the gene encoding a viral protein kinase (AMV197). Insect-born entomopoxviruses (Fam: Poxviridae) are potentially important bio-pesticide against insect pests and expression vectors as well as vectors for transient human gene therapies including recombinant viral vaccines. For these reasons, it is necessary to understand the regulatory genes functions to improve its biotechnological potential. Here, we focused on the characterization of serine / threonine (Ser / Thr; ORF AMV197) protein kinase gene from the Amsacta moorei entomopoxvirus (AMEV), the type species of the genus Betaentomopoxvirus. Transcription of the parental and an amv197-null recombinant AMEV was compared by whole-genome gene expression microarray analysis. Blast2GO analysis reflected a broad diversity of upregulated and downregulated genes. Results showed that expression levels of 102 genes (45%) out of 226 tested genes changed significantly in the recombinant AMEV infected cells. Of these transcripts, 72 (70.58%) were upregulated and 30 (29.41%) were downregulated throughout the infection period. Genes involved in DNA repair, replication and nucleotide metabolism, transcription and RNA modification, and protein modification were mostly upregulated at different times in cells infected with the recombinant virus. Furthermore, transcription of all studied cellular genes including metabolism of apoptosis (Nedd2-like caspase, hemolin and elongation factor-1 alpha (ef1a) gene) was downregulated in the absence of amv197. Quantitative real time reverse transcription-PCR confirmed viral transcriptional changes obtained by microarray. The results of this study indicated that the product of amv197 appears to affect the transcriptional regulation of most viral and many cellular genes. Further investigations are, however, needed to narrow down the role of AMV197 throughout the infection process.  "
negative,"Beyond Drosophila: RNAi in vivo and functional genomics in insects. The increasing availability of insect genomes has revealed a large number of genes with unknown functions and the resulting problem of how to discover these functions. The RNA interference (RNAi) technique, which generates loss-of-function phenotypes by depletion of a chosen transcript, can help to overcome this challenge. RNAi can unveil the functions of new genes, lead to the discovery of new functions for old genes, and find the genes for old functions. Moreover, the possibility of studying the functions of homologous genes in different species can allow comparisons of the genetic networks regulating a given function in different insect groups, thereby facilitating an evolutionary insight into developmental processes. RNAi also has drawbacks and obscure points, however, such as those related to differences in species sensitivity. Disentangling these differences is one of the main challenges in the RNAi field. "
negative,"Genome-wide annotation of cuticular proteins in the oriental fruit fly (Bactrocera dorsalis), changes during pupariation and expression analysis of CPAP3 protein genes in response to environmental stresses. Cuticular proteins (CPs) are essential components of the insect cuticle as they create a structural and protective shield and may have a role in insect development. In this paper, we studied the CPs in the oriental fruit fly (Bactrocera dorsalis), one of the most economically important pests in the Tephritidae family around the world. The availability of a complete genome sequence (NCBI Assembly: ASM78921v2) allowed the identification of 164 CP genes in B. dorsalis. Comparative analysis of the CPs in B. dorsalis with those in the model insect Drosophila melanogaster and the closely related Ceratitis capitata, and CPs from mosquitoes, Lepidoptera, Hymenoptera and Coleoptera identified Diptera-specific genes and cuticle development patterns. Analysis of their evolutionary relationship revealed that some CP families had evolved according to the phylogeny of the different insect species, while others shared a closer relationship based on domain architecture. Subsequently, transcriptome analysis showed that while most of the CPs (60-100% of the family members) are expressed in the epidermis, some were also present in internal organs such as the fat body and the reproductive organs. Furthermore, the study of the expression profiles throughout development revealed a profound change in the expression of CPs during the formation of the puparium (pupariation). Further analysis of the expression profiles of the CPAP3 genes under various environmental stresses revealed them to be involved in the response to pesticides and arid and extreme temperatures conditions. In conclusion, the data provide a particular overview of CPs and their evolutionary and transcriptional dynamics, and in turn they lay a molecular foundation to explore their roles in the unique developmental process of insect metamorphosis and stress responses. "
negative,"Molecular characterization of mariner-like elements in emerald ash borer, Agrilus planipennis (Coleoptera, Polyphaga). Emerald ash borer (EAB, Agrilus planipennis), an exotic invasive pest, has killed millions of ash trees (Fraxinus spp.) in North America and continues to threaten the very survival of the entire Fraxinus genus. Despite its high-impact status, to date very little knowledge exists for this devastating insect pest at the molecular level. Mariner-like elements (MLEs) are transposable elements, which are ubiquitous in occurrence in insects and other invertebrates. Because of their low specificity and broad host range, they can be used for epitope-tagging, gene mapping, and in vitro mutagenesis. The majority of the known MLEs are inactive due to in-frame shifts and stop codons within the open reading frame (ORF). We report on the cloning and characterization of two MLEs in A. planipennis genome (Apmar1 and Apmar2). Southern analysis indicated a very high copy number for Apmar1 and a moderate copy number for Apmar2. Phylogenetic analysis revealed that both elements belong to the irritans subfamily. Based on the high copy number for Apmar1, the full-length sequence was obtained using degenerate primers designed to the inverted terminal repeat (ITR) sequences of irritans MLEs. The recovered nucleotide sequence for Apmar1 consisted of 1,292 bases with perfect ITRs, and an ORF of 1,050 bases encoding a putative transposase of 349 amino acids. The deduced amino acid sequence of Apmar1 contained the conserved regions of mariner transposases including WVPHEL and YSPDLAP, and the D,D(34)D motif. Both Apmar1 and Apmar2 could represent useful genetic tools and provide insights on EAB adaptation. "
negative,"The impact of microbial symbionts on host plant utilization by herbivorous insects. Herbivory, defined as feeding on live plant tissues, is characteristic of highly successful and diverse groups of insects and represents an evolutionarily derived mode of feeding. Plants present various nutritional and defensive barriers against herbivory; nevertheless, insects have evolved a diverse array of mechanisms that enable them to feed and develop on live plant tissues. For decades, it has been suggested that insect-associated microbes may facilitate host plant use, and new molecular methodologies offer the possibility to elucidate such roles. Based on genomic data, specialized feeding on phloem and xylem sap is highly dependent on nutrient provisioning by intracellular symbionts, as exemplified by Buchnera in aphids, although it is unclear whether such symbionts play a substantive role in host plant specificity of their hosts. Microorganisms present in the gut or outside the insect body could provide more functions including digestion of plant polymers and detoxification of plant-produced toxins. However, the extent of such contributions to insect herbivory remains unclear. We propose that the potential functions of microbial symbionts in facilitating or restricting the use of host plants are constrained by their location (intracellular, gut or environmental), and by the fidelity of their associations with insect host lineages. Studies in the next decade, using molecular methods from environmental microbiology and genomics, will provide a more comprehensive picture of the role of microbial symbionts in insect herbivory.  "
