category,text
negative,"The closely related neuropeptide genes encoding adipokinetic hormones I and II have very different 5'-flanking regions. Adipokinetic hormones I and II are 10- and 8-amino-acid grasshopper neuropeptides that are derived from 63- and 61-amino-acid peptide precursors, respectively. Each precursor is encoded by a separate gene consisting of three very small exons separated by two large introns. The identical exon structure of the two genes suggests that they evolved through duplication of a common ancestral gene. Despite the precise conservation of exon structure and the similarity of the coding sequences, the two genes have very different 5'-flanking regions, suggesting that they are differentially regulated. For example, sequences similar to the vertebrate insulin enhancer elements NIR and FAR are present upstream of the promoter region of the adipokinetic hormone II gene, but not in the adipokinetic hormone I gene. Both of these insect genes contain short interspersed repetitive DNA sequences in their introns that may have facilitated a gene duplication event. "
negative,"Feasibility, limitation and possible solutions of RNAi-based technology for insect pest control. Numerous studies indicate that target gene silencing by RNA interference (RNAi) could lead to insect death. This phenomenon has been considered as a potential strategy for insect pest control, and it is termed RNAi-mediated crop protection. However, there are many limitations using RNAi-based technology for pest control, with the effectiveness target gene selection and reliable double-strand RNA (dsRNA) delivery being two of the major challenges. With respect to target gene selection, at present, the use of homologous genes and genome-scale high-throughput screening are the main strategies adopted by researchers. Once the target gene is identified, dsRNA can be delivered by micro-injection or by feeding as a dietary component. However, micro-injection, which is the most common method, can only be used in laboratory experiments. Expression of dsRNAs directed against insect genes in transgenic plants and spraying dsRNA reagents have been shown to induce RNAi effects on target insects. Hence, RNAi-mediated crop protection has been considered as a potential new-generation technology for pest control, or as a complementary method of existing pest control strategies; however, further development to improve the efficacy of protection and range of species affected is necessary. In this review, we have summarized current research on RNAi-based technology for pest insect management. Current progress has proven that RNAi technology has the potential to be a tool for designing a new generation of insect control measures. To accelerate its practical application in crop protection, further study on dsRNA uptake mechanisms based on the knowledge of insect physiology and biochemistry is needed. "
negative,"Genome Investigations of Vector Competence in Aedes aegypti to Inform Novel Arbovirus Disease Control Approaches. Dengue (DENV), yellow fever, chikungunya, and Zika virus transmission to humans by a mosquito host is confounded by both intrinsic and extrinsic variables. Besides virulence factors of the individual arboviruses, likelihood of virus transmission is subject to variability in the genome of the primary mosquito vector, Aedes aegypti. The ""vectorial capacity"" of A. aegypti varies depending upon its density, biting rate, and survival rate, as well as its intrinsic ability to acquire, host and transmit a given arbovirus. This intrinsic ability is known as ""vector competence"". Based on whole transcriptome analysis, several genes and pathways have been predicated to have an association with a susceptible or refractory response in A. aegypti to DENV infection. However, the functional genomics of vector competence of A. aegypti is not well understood, primarily due to lack of integrative approaches in genomic or transcriptomic studies. In this review, we focus on the present status of genomics studies of DENV vector competence in A. aegypti as limited information is available relative to the other arboviruses. We propose future areas of research needed to facilitate the integration of vector and virus genomics and environmental factors to work towards better understanding of vector competence and vectorial capacity in natural conditions. "
negative,"Polydnavirus genes and genomes: emerging gene families and new insights into polydnavirus replication. Polydnavirus genome sequencing is providing new insights into viral genome organization and viral gene function. Sequence analyses demonstrate that the genomes of these viral mutualists are largely noncoding but maintain genes and gene families that are unrelated to other viral genes. Interestingly, these organizational patterns in polydnavirus genomes are evident in both the bracovirus and ichnovirus genera, even though these two genera are evolutionarily unrelated. The identity and function of some polydnavirus gene families are considered with some functions experimentally supported and others implied by homology relationships with known insect genes. The evidence relative to polydnavirus origins and evolution is considered but remains an area of speculation. However, sequencing of these viral genomes has been informative and provides opportunities for productive investigation of these unusual mutualistic insect viruses. "
negative,"Genome sequence of a polydnavirus: insights into symbiotic virus evolution. Little is known of the fate of viruses involved in long-term obligatory associations with eukaryotes. For example, many species of parasitoid wasps have symbiotic viruses to manipulate host defenses and to allow development of parasitoid larvae. The complete nucleotide sequence of the DNA enclosed in the virus particles injected by a parasitoid wasp revealed a complex organization, resembling a eukaryote genomic region more than a viral genome. Although endocellular symbiont genomes have undergone a dramatic loss of genes, the evolution of symbiotic viruses appears to be characterized by extensive duplication of virulence genes coding for truncated versions of cellular proteins. "
negative,"The search for novel insecticide targets in the post-genomics era, with a specific focus on G-protein coupled receptors. Insects are considered pests globally, implicated in the destruction of agricultural fields and transmission of pathogens that cause deadly human diseases, such as dengue, Zika and malaria. The diversity of the insecticide arsenal has remained stagnant for decades, but the recent rise of insecticide resistance fueled the discovery of novel modes of action, and the power of genomics has reinvigorated this search. This review discusses the importance of comparative and functional insect genomics in the identification of potential gene targets for an insecticidal mode of action with low off-target toxicity. Due to the global participation in the sequencing and annotation of insect genomes, the targeting of specific genes with molecular tools like RNAi and CRISPR / Cas9 for genome engineering and consequent functional identification and validation has become more efficient. While there are multiple avenues to explore for insecticidal candidates, this review identifies G-protein coupled receptors as attractive targets, and hones in on the octopamine and dopamine receptors due to their potential. "
negative,"Ikirara, a novel transposon family from the malaria vector mosquito, Anopheles gambiae. Members of a novel transposon family, Ikirara, were found in the genome of the malaria vector Anopheles gambiae. They are most abundant in A. gambiae sensu stricto, but related sequences were found in all four other tested members of this species complex. No relatives were found in A. funestus or A. stephensi. Ikirara1, the first isolated family member, was found between two of the tandem Vitellogenin (Vg) genes. Because it was found at this location in G3 and only one of nine other A. gambiae s.s. strains examined, and because its 216 bp inverted terminal repeats are 100% identical, transposition to this locus may have been recent. Ikirara1 inverted repeat terminal sequences are similar to those of DNA to DNA transposons of the mariner / Tc1 and hAT superfamilies. Also similar to mariner / Tc1 elements, insertion of Ikirara1 apparently created a duplication of the dinucleotide TA at the target site. "
positive,"Use of tyrosine hydroxylase RNAi to study Megoura viciae (Hemiptera: Aphididae) sequestration of its host's l-DOPA for body melanism. Melanism in insects is important for their physical protection, immunoreactions, and sclerotization. The vetch aphid, Megoura viciae (Buckton), has relatively strong tanning in its prothorax, head, antennae, cornicles, and legs. It was hypothesized that M. viciae may sequester the high level of l-DOPA in its host Vicia faba to help in its melanization process for ecological adaptation. To confirm this hypothesis, the amount of l-DOPA in M. viciae was modified and quantified. We first generated a Trifolium repens (clover, low l-DOPA containing) host to cut off the extra l-DOPA intake by M. viciae. The rate-limiting tyrosine hydroxylase gene of M. viciae (MV-TH) was then cloned and analyzed. To further reduce the l-DOPA level in the insect, RNAi was used to downregulate the transcriptional level of MV-TH. Our results confirmed that M. viciae could indeed sequester l-DOPA in its body, and its ample storage of this amino acid could be the reason for the strong tanning of its body. M. viciae reared on T. repens could upregulate its MV-TH to enhance l-DOPA biosynthesis and thus maintain a high level of l-DOPA. The MV-TH repression by RNAi lasted for about 3 days, successfully decreasing the l-DOPA level. Aside from a slight decrease in exuvia tanning, no other obvious change in body appearance was detected in the RNAi-treated insect. Although M. viciae can obtain most of its l-DOPA directly from its original host, its internal l-DOPA synthetase is still functional, especially when extra l-DOPA is removed from the diet. This capability to enhance its shield ensures the ecological adaptation of this insect. "
negative,"Comparative and functional genomics of lipases in holometabolous insects. Lipases have key roles in insect lipid acquisition, storage and mobilisation and are also fundamental to many physiological processes underpinning insect reproduction, development, defence from pathogens and oxidative stress, and pheromone signalling. We have screened the recently sequenced genomes of five species from four orders of holometabolous insects, the dipterans Drosophila melanogaster and Anopheles gambiae, the hymenopteran Apis mellifera, the moth Bombyx mori and the beetle Tribolium castaneum, for the six major lipase families that are also found in other organisms. The two most numerous families in the insects, the neutral and acid lipases, are also the main families in mammals, albeit not in Caenorhabditis elegans, plants or microbes. Total numbers of the lipases vary two-fold across the five insect species, from numbers similar to those in mammals up to numbers comparable to those seen in C. elegans. Whilst there is a high degree of orthology with mammalian lipases in the other four families, the great majority of the insect neutral and acid lipases have arisen since the insect orders themselves diverged. Intriguingly, about 10% of the insect neutral and acid lipases have lost motifs critical for catalytic function. Examination of the length of lid and loop regions of the neutral lipase sequences suggest that most of the insect lipases lack triacylglycerol (TAG) hydrolysis activity, although the acid lipases all have intact cap domains required for TAG hydrolysis. We have also reviewed the sequence databases and scientific literature for insights into the expression profiles and functions of the insect neutral and acid lipases and the orthologues of the mammalian adipose triglyceride lipase which has a pivotal role in lipid mobilisation. These data suggest that some of the acid and neutral lipase diversity may be due to a requirement for rapid accumulation of dietary lipids. The different roles required of lipases at the four discrete life stages of holometabolous insects may also contribute to the diversity of lipases required by insects. In addition, insects use lipases to perform roles for which there are no correlates in mammals, including as yolk and male accessory gland proteins. "
negative,"Genome-wide dissection of sex determination genes in the highly invasive whitefly species Bemisia tabaci Q / MED. Sex determination genes are important regulators of reproduction as well as of the development of both behavioural and morphological sex characteristics. The sweetpotato whitefly, Bemisia tabaci (Gennadius) (Hemiptera: Aleyrodidae), is an emerging insect pest worldwide. The recent release of the genome sequence of the highly invasive B. tabaciQ / MED allows us to investigate the mechanisms and genes involved in sex determination. The combined genome and transcriptome-wide analyses identified 26 genes putatively associated with sex determination in B. tabaciQ / MED. The temporal profiles of these genes exhibited a consistent expression pattern at all B. tabaci developmental stages: the highest transcript levels were detected in eggs (21 genes, 80.8%) and the lowest in adults (24 genes, 92.3%). The expression pattern was further validated by quantitative real-time reverse transcription PCR analysis. Alternative splicing analysis found that (1) da and mle have sex-specific isoforms in B. tabaci adults, whereas Imp does not, and (2) exon skipping is a common splicing mechanism involved in B. tabaci sex determination. This research provides a comprehensive list of genes involved in B. tabaci sex determination and provides an opportunity to further understand the mechanisms underlying sex determination in a globally invasive insect pest that reproduces both sexually and asexually. "
positive,"Molecular cloning of a multidomain cysteine protease and protease inhibitor precursor gene from the tobacco hornworm (Manduca sexta) and functional expression of the cathepsin F-like cysteine protease domain. A Manduca sexta (tobacco hornworm) cysteine protease inhibitor, MsCPI, purified from larval hemolymph has an apparent molecular mass of 11.5 kDa, whereas the size of the mRNA is very large (∼9 kilobases). MsCPI cDNA consists of a 9,273 nucleotides that encode a polypeptide of 2,676 amino acids, which includes nine tandemly repeated MsCPI domains, four cystatin-like domains and one procathepsin F-like domain. The procathepsin F-like domain protein was expressed in Escherichia coli and processed to its active mature form by incubation with pepsin. The mature enzyme hydrolyzed Z-Leu-Arg-MCA, Z-Phe-Arg-MCA and Boc-Val-Leu-Lys-MCA rapidly, whereas hydrolysis of Suc-Leu-Tyr-MCA and Z-Arg-Arg-MCA was very slow. The protease was strongly inhibited by MsCPI, egg-white cystatin and sunflower cystatin with K(i) values in the nanomolar range. When the MsCPI tandem protein linked to two MsCPI domains was treated with proteases, it was degraded by the cathepsin F-like protease. However, tryptic digestion converted the MsCPI tandem protein to an active inhibitory form. These data support the hypothesis that the mature MsCPI protein is produced from the MsCPI precursor protein by trypsin-like proteases. The resulting mature MsCPI protein probably plays a role in the regulation of the activity of endogenous cysteine proteases. "
negative,"Insect iron binding proteins: insights from the genomes. Sequencing of the genomes of Drosophila melanogaster, Anopheles gambiae, Apis mellifera, and Bombyx mori provided an opportunity to examine the diversity and organization of genes encoding insect transferrins (Tsf) and ferritins. Information obtained from the genomes significantly advances our knowledge of these major players in insect iron metabolism and complements the results of molecular studies on their temporal, spatial, and inducible expression pattern and regulatory mechanisms conducted in diverse insect species. Analysis of genes encoding new members of the Tsf family and non-secreted ferritin subunits allows making preliminary hypotheses about their possible functions and opens possibilities to study lesser-known aspects of insect iron homeostasis. Proteomic and gene expression studies that followed the whole genome sequencing quickly contribute to defining or better understanding of the important and diverse biological roles of Tsf and ferritin, particularly their involvement in insect's defenses against oxidative stress and infection. "
positive,"Expression of a doublesex homologue is altered in sexual mosaics of Ostrinia scapulalis moths infected with Wolbachia. A homologue of the sex-determining gene doublesex, Osdsx, was identified in the adzuki bean borer Ostrinia scapulalis. Three isoforms of the Osdsx transcript (Osdsx(M), Osdsx(FL) and Osdsx(FS)) differing in length were found. Osdsx(M) was specifically found in males, and contained an 852-bp ORF encoding a protein of 284 amino acids. Osdsx(FL) and Osdsx(FS) were found in females, and had the same 813-bp ORF encoding a protein of 271 amino acids. The Osdsx gene was inferred to have six exons and five introns. The variation in the transcript could be explained by the alternative splicing of Osdsx: Osdsx(M) was formed by the splicing of exons 1, 2, 5 and 6, Osdsx(FS) by the splicing of exons 1-4 and 6, and Osdsx(FL) by the splicing of exons 1-6. RT-PCR analysis indicated that Osdsx was transcribed in a sex-specific manner in all somatic tissues examined, regardless of developmental stage. In Wolbachia-induced sexual mosaics of O. scapulalis, which are genetically male, the female-specific isoform of Osdsx (Osdsx(FL)) was shown to be expressed in addition to the male-specific isoform (Osdsx(M)). This finding provides the first evidence that Wolbachia manipulates the sex of its host by interfering either with the sex-specific splicing of Osdsx itself or with another upstream sex determination process. "
negative,"Mobility of the piggyBac transposon in embryos of the vectors of Dengue fever (Aedes albopictus) and La Crosse encephalitis (Ae. triseriatus). The re-emergence of arboviral diseases such as Dengue Fever and La Crosse encephalitis is primarily due to the failure of insect vector control strategies. The development of a procedure capable of producing stable germ-line transformants in the insect vectors of these diseases would bridge the gap between gene expression systems being developed to curb vector transmission and the identification of important genes and regulatory sequences and their reintroduction back into the insect genome in the form of vector control strategies. The transposable element piggyBac is capable of transposition in a variety of insect species, and could serve as a versatile insect transformation vector. Using plasmid-based excision and transposition assays, we report that this short-ITR transposon undergoes precise, transposase-dependent excision and transposition in embryos of Aedes albopictus and Aedes triseriatus, the vectors of Dengue fever and LaCrosse encephalitis, respectively. These assays allow us easily and rapidly to confirm and assess the potential utility of piggyBac as a gene transfer tool in a given species. piggyBac is an exceptionally mobile and versatile genetic transformation vector, comparable to other transposons currently in use for the transformation of insects. The mobility of the piggyBac element seen in both Ae. albopictus and Ae. triseriatus is further evidence that it can be employed as a germ-line vector in important insect disease vectors. "
positive,"Characterization and expression profiling of odorant-binding proteins in Anoplophora glabripennis Motsch. In insects, olfaction plays a critical role in locating hosts, recognizing mates, and selecting oviposition sites. The Asian long-horned beetle (Anoplophora glabripennis Motschulsky) feeds on 43 species of trees in 15 families, but its chemosensory mechanisms are poorly understood. Herein, genes encoding 61 odorant-binding proteins (OBPs) were identified from the published genome and our previous A. glabripennis transcriptomic data. To investigate their physiological functions, we performed expression profiling of all AglaOBPs in the antennae, legs, and maxillary palps of both sexes. Phylogenetic analysis clustered A. glabripennis OBPs into four subgroups, comprising 29 Minus-C OBPs, 15 Antennae-binding proteins (ABPIIs), 10 Classic OBPs, and one Plus-C OBP. 12 AglaOBP genes were expressed specifically in antennae, and AglaOBP3, AglaOBP18, AglaOBP21, AglaOBP33, AglaOBP41, AglaOBP45, and AglaOBP47 were particularly highly expressed in male antennae. These proteins may function in the detection of female sex pheromones. AglaOBP23 and AglaOBP44 were preferentially expressed in maxillary palps. Expression profiling suggests that many OBPs may be involved in olfaction and gustation, in addition to carrying hydrophobic molecules. The AglaOBPs family has acquired functional diversity concurrently with functional constraints, and further investigation could provide insight into the roles of OBPs in chemoreception. "
negative,"Genomic sequence and phylogenetic analysis of Culex flavivirus, an insect-specific flavivirus, isolated from Culex pipiens (Diptera: Culicidae) in Iowa. Adult mosquitoes (Diptera: Culicidae) were collected in 2007 and tested for specific viruses, including West Nile virus, as part of the ongoing arbovirus surveillance efforts in the state of Iowa. A subset of these mosquitoes (6,061 individuals in 340 pools) was further tested by reverse transcription-polymerase chain reaction (RT-PCR) using flavivirus universal primers. Of the 211 pools of Culex pipiens (L.) tested, 50 were positive. One of 51 pools of Culex tarsalis Coquillet was also positive. The flavivirus minimum infection rates (expressed as the number of positive mosquito pools per 1,000 mosquitoes tested) for Cx. pipiens and Cx. tarsalis were 10.3 and 1.2, respectively. Flavivirus RNA was not detected in Aedes triseriatus (Say) (52 pools), Culex erraticus (Dyar & Knab) (25 pools), or Culex territans Walker (one pool). Sequence analysis of all RT-PCR products revealed that the mosquitoes had been infected with Culex flavivirus (CxFV), an insect-specific virus previously isolated in Japan, Indonesia, Texas, Mexico, Guatemala and Trinidad. The complete genome of one isolate was sequenced, as were the envelope protein genes of eight other isolates. Phylogenetic analysis revealed that CxFV isolates from the United States (Iowa and Texas) are more closely related to CxFV isolates from Asia than those from Mexico, Guatemala, and Trinidad. "
negative,"A genomic analysis of transcytosis in the pea aphid, Acyrthosiphon pisum, a mechanism involved in virus transmission. Aphids are the primary vectors of plant viruses. Transmission can occur via attachment to the cuticle lining of the insect (non-circulative transmission) or after internalization in the insect cells with or without replication (circulative transmission). In this paper, we have focused on the circulative and non-propagative mode during which virions enter the cell following receptor-mediated endocytosis, are transported across the cell in vesicles and released by exocytosis without replicating. The correct uptake, transport and delivery of the vesicles cargo relies on the participation of proteins from different families which have been identified in the Acyrthosiphon pisum genome. Assemblage of this annotated dataset provides a useful basis to improve our understanding of the molecules and mechanisms involved in virus transmission by A. pisum and other aphid species. "
negative,"Genetic technologies for disease vectors. The first genetic technologies for insect vectors of disease were introduced 20 years ago. As of today there are 12 classes of genetic technologies used as functional genomic tools for insect vectors of important diseases. Although the applications of genetic technologies in insect disease vectors have been conducted primarily in mosquitoes, other insect systems could benefit from current technologies. While the various technological platforms are likely to function in diverse arthropods, the delivery of these technologies to cells and tissues of interest is the major technical constraint that limits their widespread adoption. Increased community resources of various types would enhance the adoption of these technologies and potentially eliminate technical limitations. "
