category,text
negative,"Development of bacterial artificial chromosome library resources for parasitoid Hymenoptera (Nasonia vitripennis and Nasonia giraulti: Pteromalidae). The species of the genus Nasonia possess qualities that make them excellent candidates for genetic and genomic studies. To increase the wealth of genomic resources for the genus we constructed publicly available bacterial artificial chromosome (BAC) libraries for Nasonia vitripennis and Nasonia giraulti. Libraries have 36 864 clones each, empty-vector contents of approximately 2% and average insert sizes of 113.1 and 97.7 Kb, respectively, representing 12 and 11 genome equivalents. The N. vitripennis library was used for genome sequence assembly and in efforts at positional cloning of a developmental gene. The genome assembly of N. vitripennis is currently composed on 6181 un-joined scaffolds. These BAC libraries can be used to identify and close regions between scaffolds of the genome assemblies of both species. "
negative,Amplification of complete insect mitochondrial genome in two easy pieces. The entire insect mitochondrial genome has been amplified in just two PCR reactions. 'Universal' insect primers and techniques to optimize amplification of long PCR products were used to obtain segments of the mitochondrial genomes of Helicoverpa zea and Heliothis virescens (Lepidoptera) ranging in size from 3.7 kb to 14 kb or about 25% to over 85% of a typical 16 kb mtDNA. Overlapping pairs of fragments contain the complete mtDNA sequence. 
positive,"Anopheles stephensi Dox-A2 shares common ancestry with genes from distant groups of eukaryotes encoding a 26S proteasome subunit and is in a conserved gene cluster. The sequence of a cloned Anopheles stephensi gene showed 72% inferred amino acid identity with Drosophila melanogaster Dox-A2 and 93% with its putative ortholog in Anopheles gambiae. Dox-A2 is the reported but herein disputed structural locus for diphenol oxidase A2. Database searches identified Dox-A2 related gene sequences from 15 non-insect species from diverse groups. Phylogenetic trees based on alignments of inferred protein sequences, DNA, and protein motif searches and protein secondary structure predictions produced results consistent with expectations for genes that are orthologous. The only inconsistency was that the C-terminus appears to be more primitive in the yeasts than in plants. In mammals, plants, and yeast these genes have been shown to code for a non-ATPase subunit of the PA700 (19S) regulatory complex of 26S proteasome. The analyses indicated that the insect genes contain no divergent structural features, which taken within an appraisal of all available data, makes the reported alternative function highly improbable. A plausible additional role, in which the 26S proteasome is implicated in regulation of phenol oxidase, would also apply to at least the mammalian genes. No function has yet been reported for the other included sequences. These were from genome projects and included Caenorhabiditus elegans, Arabidopsis thaliana, Fugu rubripes, and Toxoplasma gondii. A consensus of the results predicts a protein containing exceptionally long stretches of helix with a hydrophilic C-terminus. Phosphorylation site motifs were identified at two conserved positions. Possible SRY and GATA-1 binding motifs were found at conserved positions upstream of the mosquito genes. The location of A. stephensi Dox-A2 was determined by in situ hybridization at 34D on chromosome arm 3R. It is in a conserved gene cluster with respect to the other insects. However, the A. stephensi cluster contains a gene showing significant sequence identity to human and pigeon carnitine acetyltransferase genes, therefore showing divergence with the distal end of the D. melanogaster cluster. "
negative,"Estimation of the Whitefly Bemisia tabaci Genome Size Based on k-mer and Flow Cytometric Analyses. Whiteflies of the Bemisia tabaci (Hemiptera: Aleyrodidae) cryptic species complex are among the most important agricultural insect pests in the world. These phloem-feeding insects can colonize over 1000 species of plants worldwide and inflict severe economic losses to crops, mainly through the transmission of pathogenic viruses. Surprisingly, there is very little genomic information about whiteflies. As a starting point to genome sequencing, we report a new estimation of the genome size of the B. tabaci B biotype or Middle East-Asia Minor 1 (MEAM1) population. Using an isogenic whitefly colony with over 6500 haploid male individuals for genomic DNA, three paired-end genomic libraries with insert sizes of ~300 bp, 500 bp and 1 Kb were constructed and sequenced on an Illumina HiSeq 2500 system. A total of ~50 billion base pairs of sequences were obtained from each library. K-mer analysis using these sequences revealed that the genome size of the whitefly was ~682.3 Mb. In addition, the flow cytometric analysis estimated the haploid genome size of the whitefly to be ~690 Mb. Considering the congruency between both estimation methods, we predict the haploid genome size of B. tabaci MEAM1 to be ~680-690 Mb. Our data provide a baseline for ongoing efforts to assemble and annotate the B. tabaci genome.  "
positive,"RNA interference of timeless gene does not disrupt circadian locomotor rhythms in the cricket Gryllus bimaculatus. Molecular studies revealed that autoregulatory negative feedback loops consisting of so-called ""clock genes"" constitute the circadian clock in Drosophila. However, this hypothesis is not fully supported in other insects and is thus to be examined. In the cricket Gryllus bimaculatus, we have previously shown that period (per) plays an essential role in the rhythm generation. In the present study, we cloned cDNA of the clock gene timeless (tim) and investigated its role in the cricket circadian oscillatory mechanism using RNA interference. Molecular structure of the cricket tim has rather high similarity to those of other insect species. Real-time RT-PCR analysis revealed that tim mRNA showed rhythmic expression in both LD and DD similar to that of per, peaking during the (subjective) night. When injected with tim double-stranded RNA (dstim), tim mRNA levels were significantly reduced and its circadian expression rhythm was eliminated. After the dstim treatment, however, adult crickets showed a clear locomotor rhythm in DD, with a free-running period significantly shorter than that of control crickets injected with Discosoma sp. Red2 (DsRed2) dsRNA. These results suggest that in the cricket, tim plays some role in fine-tuning of the free-running period but may not be essential for oscillation of the circadian clock. "
negative,"Genome-wide analysis of transcriptomic divergence between laboratory colony and field Anopheles gambiae mosquitoes of the M and S molecular forms. Our knowledge of Anopheles gambiae molecular biology has mainly been based on studies using inbred laboratory strains. Differences in the environmental exposure of these and natural field mosquitoes have inevitably led to physiological divergences. We have used global transcript abundance analyses to probe into this divergence, and identified transcript abundance patterns of genes that provide insight on specific adaptations of caged and field mosquitoes. We also compared the gene transcript abundance profiles of field mosquitoes belonging to the two morphologically indistinguishable but reproductively isolated sympatric molecular forms, M and S, from two different locations in the Yaoundé area of Cameroon. This analysis suggested that environmental exposure has a greater influence on the transcriptome than does the mosquito's molecular form-specific genetic background. "
negative,"Molecular Characterization of the 2016 New World Screwworm (Diptera: Calliphoridae) Outbreak in the Florida Keys. New World screwworm (NWS), Cochliomyia hominivorax (Coquerel 1858) (Diptera: Calliphoridae), is a myiasis-causing fly that can be a serious threat to the health of livestock, wildlife, and humans. Its progressive eradication from the southern United States, Mexico, and Central America from the 1950s to 2000s is an excellent example of successful pest management using sterile insect technique (SIT). In late 2016, autochthonous NWS were detected in the Florida Keys, representing this species' first invasion in the United States in >30 yr. Rapid use of quarantine and SIT was successful in eliminating the infestation by early 2017; however, the geographic source of this infestation remains unknown. Here, we use amplicon sequencing to generate mitochondrial and nuclear sequence data representing all confirmed cases of NWS from this infestation, and compare these sequences to preexisting data sets sampling the native distribution of NWS. We ask two questions regarding the FL Keys outbreak. First, is this infestation the result of a single invasion from one source, or multiple invasions from different sources? And second, what is the geographic origin of this invasion? We found virtually no sequence variation between specimens collected from the FL Keys outbreak, which is consistent with a single source of introduction. However, we also found very little geographic resolution in any of the data sets, which precludes identification of the source of this outbreak. Our lack of success in answering our second question speaks to the need for finer-scale genetic or genomic assessments of NWS population structure, which would facilitate source determination of potential future outbreaks. "
positive,"Targeting the potassium ion channel genes SK and SH as a novel approach for control of insect pests: efficacy and biosafety. BACKGROUND: Potassium ion channels play a critical role in the generation of electrical signals and thus provide potential targets for control of insect pests by RNA interference. RESULTS: Genes encoding the small conductance calcium-activated potassium channel (SK) and the voltage-gated potassium channel (SH) were knocked down in Tribolium castaneum by injection and oral delivery of dsRNA (dsTcSK and dsTcSH, respectively). Irrespective of the delivery mechanism a dose-dependent effect was observed for knockdown (KD) of gene expression and insect mortality for both genes. Larvae fed a 400 ng dsRNA mg-1 diet showed significant gene (P < 0.05) knockdown (98% and 83%) for SK and SH, respectively, with corresponding mortalities of 100% and 98% after 7 days. When injected (248.4 ng larva-1 ), gene KD was 99% and 98% for SK and SH, causing 100% and 73.4% mortality, respectively. All developmental stages tested (larvae, early- and late-stage pupae and adults) showed an RNAi-sensitive response for both genes. LC50 values were lower for SK than SH, irrespective of delivery method, demonstrating that the knockdown of SK had a greater effect on larval mortality. Biosafety studies using adult honeybee Apis mellifera showed that there were no significant differences either in expression levels or mortality of honeybees orally dosed with dsTcSK and dsTcSH compared to control-fed bees. Similarly, there was no significant difference in the titre of deformed wing virus, used as a measure of immune suppression, between experimental and control bees. CONCLUSION: This study demonstrates the potential of using RNAi targeting neural receptors as a technology for the control of T. castaneum. © 2019 The Authors. Pest Management Science published by John Wiley & Sons Ltd on behalf of Society of Chemical Industry. "
negative,"Characterization of burdock mottle virus, a novel member of the genus Benyvirus, and the identification of benyvirus-related sequences in the plant and insect genomes. The complete nucleotide sequence of the burdock mottle virus (BdMoV) isolated from an edible burdock plant (Arctium lappa) in Japan has been determined. BdMoV has a bipartite genome, whose organization is similar to RNA1 and RNA2 of benyviruses, beet necrotic yellow vein virus (BNYVV), beet soil-borne mosaic virus (BSBMV), and rice stripe necrosis virus (RSNV). BdMoV RNA1 (7038 nt) contains a single open reading frame (ORF) encoding a 249-kDa polypeptide that consists of methyl-transferase, helicase, papain-like protease, AlkB-like, and RNA-dependent RNA polymerase domains. The AlkB-like domain sequence is not present in the proteins encoded by other known benyviruses, but is found in replication-associated proteins of viruses mainly belonging to the families Alfaflexiviridae and Betaflexiviridae. BdMoV RNA2 (4315 nt) contains six ORFs that are similar to those of benyviruses: these are coat protein (CP), CP readthrough, triple gene block movement and cysteine-rich proteins. Phylogenetic analyses showed that BdMoV is more closely related to BNYVV and BSBMV than to RSNV. Database searches showed that benyvirus replicase-related sequences are present in the chromosomes of a chickpea plant (Cicer arietinum) and a blood-sucking insect (Rhodnius prolixus). Some other benyvirus-related sequences are found in the transcriptome shotgun libraries of a few species of plants and a bark beetle. Our results show that BdMoV is a distinct species of the genus Benyvirus and that ancestral and extant benyviruses may have infected or currently infect a wide range of hosts, including plants and insects. "
negative,"Fungal proteomics: from identification to function. Some fungi cause disease in humans and plants, while others have demonstrable potential for the control of insect pests. In addition, fungi are also a rich reservoir of therapeutic metabolites and industrially useful enzymes. Detailed analysis of fungal biochemistry is now enabled by multiple technologies including protein mass spectrometry, genome and transcriptome sequencing and advances in bioinformatics. Yet, the assignment of function to fungal proteins, encoded either by in silico annotated, or unannotated genes, remains problematic. The purpose of this review is to describe the strategies used by many researchers to reveal protein function in fungi, and more importantly, to consolidate the nomenclature of 'unknown function protein' as opposed to 'hypothetical protein' - once any protein has been identified by protein mass spectrometry. A combination of approaches including comparative proteomics, pathogen-induced protein expression and immunoproteomics are outlined, which, when used in combination with a variety of other techniques (e.g. functional genomics, microarray analysis, immunochemical and infection model systems), appear to yield comprehensive and definitive information on protein function in fungi. The relative advantages of proteomic, as opposed to transcriptomic-only, analyses are also described. In the future, combined high-throughput, quantitative proteomics, allied to transcriptomic sequencing, are set to reveal much about protein function in fungi. "
positive,"Expression and characterization of a recombinant i-type lysozyme from the harlequin ladybird beetle Harmonia axyridis. Lysozymes are enzymes that destroy bacterial cell walls by hydrolysing the polysaccharide component of peptidoglycan. In insects, there are two classes of lysozymes, the c-type with muramidase activity and the i-type whose prototypical members from annelids and molluscs possess both muramidase and isopeptidase activities. Many insect genes encoding c-type and i-type lysozymes have been identified during genome and transcriptome analyses, but only c-type lysozymes have been functionally characterized at the protein level. Here we produced one of five i-type lysozymes represented in the immunity-related transcriptome of the invasive harlequin ladybird beetle Harmonia axyridis as recombinant protein. This was the only one containing the serine and histidine residues that are thought to be required for isopeptidase activity. This i-type lysozyme was recombinantly expressed in the yeast Pichia pastoris, but the purified protein was inactive in both muramidase and isopeptidase assays. Transcription and immunofluorescence analysis revealed that this i-type lysozyme is produced in the fat body but is not inducible by immune challenge. These data suggest that i-type lysozymes in insects may have acquired novel and as yet undetermined functions in the course of evolution. "
negative,"Evolutionary genetics in insect phenotypic radiations: the value of a comparative genomic approach. Expanding genome sequencing and transgenic technologies are enabling the discovery of genes driving phenotypic diversity across insect taxa. Limitations in downstream functional genetic approaches, however, have been an obstacle for developing non-model systems for evolutionary genetics. Phenotypically diverse radiations, such as those exhibiting convergence and divergence as a result of mimicry, are ideal for evolutionary genetics as they can lead to insights using comparative genomic approaches alone. The varied and repeated instances of phenotypes in highly polymorphic systems allow assessment of whether similar loci are repeatedly targeted by selection and can inform how alleles sort across lineages. Comparative genomics of these taxa can be used to decipher components of gene regulatory networks, dissect regulatory regions, and validate genes. "
negative,"Identification of a tubulin-α gene specifically expressed in testis and adductor muscle during stable reference gene selection in the hermaphrodite gonad of the lion's paw scallop Nodipecten subnodosus. For non-model species, as many used for aquaculture, with minimal or no genomic information, relative quantification of gene expression studies requires preliminary research including the isolation of potential reference genes and the identification of those stably expressed under the biological conditions of interest. Here we report on the isolation of five partial gene sequences from gonad tissue cDNA in the functional hermaphrodite scallop Nodipecten subnodosus to be evaluated as reference genes: 18S-rRNA, riboprotein l8 (rp-l8), actin-β (act-β), elongation factor 1α (ef-1α) and alpha-tubulin-α (tub-α). We found that 18S-rRNA was stably expressed independently of the priming method used to reverse transcribe RNA to cDNA, oligo-dT or random hexamer. Stability analysis for the five putative reference genes with geNorm and NormFinder indicated that 18S together with rp-l8 were the most stable genes for normalization of gene expression during gonad development in both, male and female sexual regions of the hermaphrodite N. subnodosus. The least stable gene was tub-α, showing a biased expression profile between sexual regions of the gonad, therefore this gene was analyzed thereafter as a target gene together with vitellogenin (vit) and a DEAD-box RNA helicase (dbx) gene. Relative expression, estimated by normalization with the combination of 18S and rp-l8 as reference genes, indicated that as gonad development advanced two of the target genes were up-regulated, tub-α in the male region and vit in the female region. Whereas an increased expression was expected during development for vit for its known role in vitellogenesis, the increased expression of tub-α in the male sexual region was unexpected, and pointed toward this gene being a testis-specific α-tubulin isotype. Further analyses of gene expression among tissues indicated that tub-α is specifically and highly expressed in the male gonad, although expression in adductor muscle was also observed at significantly lower levels. The existence of testis specific α- and β-tubulins has been previously reported in other taxa, relating their function to sperm axoneme formation. Tissue-specific tubulin genes, particularly their promoters, have recently found an application as native promoters for transgene tissue-specific expression in research and reproductive control of insect plagues. The third target gene, a putative member of the DEAD-box RNA helicase family (dbx), showed no changes in expression during gonad development or between sexual regions, therefore it was chosen to discuss the different statistical inferences resulting from the arbitrary use of 'randomly chosen' reference genes when normalizing gene expression. "
negative,"Genome analysis and genetic enhancement of tomato. The Solanaceae is an important family of vegetable crops, ornamentals and medicinal plants. Tomato has served as a model member of this family largely because of its enriched cytogenetic, genetic, as well as physical, maps. Mapping has helped in cloning several genes of importance such as Pto, responsible for resistance against bacterial speck disease, Mi-1.2 for resistance against nematodes, and fw2.2 QTL for fruit weight. A high-throughput genome-sequencing program has been initiated by an international consortium of 10 countries. Since heterochromatin has been found to be concentrated near centromeres, the consortium is focusing on sequencing only the gene-rich euchromatic region. Genomes of the members of Solanaceae show a significant degree of synteny, suggesting that the tomato genome sequence would help in the cloning of genes for important traits from other Solanaceae members as well. ESTs from a large number of cDNA libraries have been sequenced, and microarray chips, in conjunction with wide array of ripening mutants, have contributed immensely to the understanding of the fruit-ripening phenomenon. Work on the analysis of the tomato proteome has also been initiated. Transgenic tomato plants with improved abiotic stress tolerance, disease resistance and insect resistance, have been developed. Attempts have also been made to develop tomato as a bioreactor for various pharmaceutical proteins. However, control of fruit quality and ripening remains an active and challenging area of research. Such efforts should pave the way to improve not only tomato, but also other solanaceous crops. "
negative,"A novel homeobox cluster expressed in repeated structures of the midgut. A gene cluster (LOX3-C) containing three duplicated homeobox sequences (Lox3A, Lox3B, and Lox3C) was characterized in the leech Hirudo medicinalis. The leech homeoboxes have a limited homology to those of Antennapedia-class genes, but do not have homologs among currently characterized insect genes. The Lox3 genes belong to a new family, named Xlox, that also includes genes from mouse, rat, frog, and a distantly related leech, Helobdella triserialis. All members of the Xlox family are expressed in specific regions of the embryonic gut, where they seem to affect morphogenesis and cell differentiation. The three homeoboxes of LOX3-C described here are contained within nearly identical direct tandem repeats. The LOX3-C region produces at least two transcripts, one present in both embryos and adults and the other only in early embryos. Early Lox3 expression is restricted to specific regions of the midgut primordium, in 12 segmentally repeated, transverse stripes of fusiform cells found at the positions where the midgut will constrict to form the 11 diverticula of the crop. A role in the development of segmentally iterated structures in an initially homogeneous midgut is proposed for LOX3-C. "
positive,"Heat shock proteins contribute to mosquito dehydration tolerance. This study examines the responses of heat shock protein transcripts, Hsp70 and Hsp90, to dehydration stress in three mosquito species, Aedes aegypti, Anopheles gambiae and Culex pipiens. We first defined the water balance attributes of adult females of each species, monitored expression of the hsp transcripts in response to dehydration, and then knocked down expression of the transcripts using RNA interference (RNAi) to evaluate potential functions of the Hsps in maintenance of water balance. Fully hydrated females of all three species contained nearly the same amount of water (66-68%), but water loss rates differed among the species, with A. aegypti having the lowest water loss rate (2.6% / h), followed by C. pipiens (3.3% / h), and A. gambiae (5.1% / h). In all three species water could be replaced only by drinking water (or blood). Both A. aegypti and C. pipiens tolerated a loss of 36% of their body water, but A. gambiae was more vulnerable to water loss, tolerating a loss of only 29% of its body water. Dehydration elicited expression of hsp70 in all three species, but only C. pipiens continued to express this transcript during rehydration. Hsp90 was constitutively expressed and expression levels remained fairly constant during dehydration and rehydration, except expression was not noted during rehydration of C. pipiens. Injection of dsRNA to knock down expression of hsp70 (83% reduction) and hsp90 (46% reduction) in A. aegypti did not alter water content or water loss rates, but the dehydration tolerance was lower. Instead of surviving a 36% water loss, females were able to survive only a 28% water loss in response to RNAi directed against hsp70 and a 26% water loss when RNAi was directed against hsp90. These results indicate a critical function for these Hsps in mosquito dehydration tolerance. "
negative,"Mining insect genomes for functionally affiliated genes. Several hundred insect genome assemblies are already publicly available, and this total grows on a weekly basis. A major challenge now confronting insect science is how best to use genomic data to improve our understanding of insect biology. We consider a framework for genome analysis based on functional affiliation, that is, groups of genes involved in the same biological process or pathway, and explore how such an approach furthers our understanding of several aspects of insect phenotype. We anticipate that this approach will prove useful for future research across the breadth of insect studies, whatever organism or trait it involves. "
