category,text
negative,"A small genomic region containing several loci required for gastrulation in Drosophila. Genetic screens in Drosophila designed to search for loci involved in gastrulation have identified four regions of the genome that are required zygotically for the formation of the ventral furrow. For three of these, the genes responsible for the mutant phenotypes have been found. We now describe a genetic characterization of the fourth region, which encompasses the cytogenetic interval 24C3-25B, and the mapping of genes involved in gastrulation in this region. We have determined the precise breakpoints of several existing deficiencies and have generated new deficiencies. Our results show that the region contains at least three different loci associated with gastrulation effects. One maternal effect gene involved in ventral furrow formation maps at 24F but could not be identified. For a second maternal effect gene which is required for germ band extension, we identify a candidate gene, CG31660, which encodes a G protein coupled receptor. Finally, one gene acts zygotically in ventral furrow formation and we identify it as Traf4. "
positive,"Genome-wide identification of chitin-binding proteins and characterization of BmCBP1 in the silkworm, Bombyx mori. The insect cuticle plays important roles in numerous physiological functions to protect the body from invasion of pathogens, physical injury and dehydration. In this report, we conducted a comprehensive genome-wide search for genes encoding proteins with peritrophin A-type (ChtBD2) chitin-binding domain (CBD) in the silkworm, Bombyx mori. One of these genes, which encodes the cuticle protein BmCBP1, was additionally cloned, and its expression and location during the process of development and molting in B. mori were investigated. In total, 46 protein-coding genes were identified in the silkworm genome, including those encoding 15 cuticle proteins analogous to peritrophins with one CBD (CPAP1s), nine cuticle proteins analogous to peritrophins with three CBD (CPAP3s), 15 peritrophic membrane proteins (PMPs), four chitinases, and three chitin deacetylases, which contained at least one ChtBD2 domain. Microarray analysis indicated that CPAP-encoding genes were widely expressed in various tissues, whereas PMP genes were highly expressed in the midgut. Quantitative polymerase chain reaction and western blotting showed that the cuticle protein BmCBP1 was highly expressed in the epidermis and head, particularly during molting and metamorphosis. An immunofluorescence study revealed that chitin co-localized with BmCBP1 at the epidermal surface during molting. Additionally, BmCBP1 was notably up-regulated by 20-hydroxyecdysone treatment. These results provide a genome-level view of the chitin-binding protein in silkworm and suggest that BmCBP1 participates in the formation of the new cuticle during molting. "
negative,"Complete genome sequence of Bacillus thuringiensis serovar alesti BGSC 4C1, a typical strain with toxicity to Lepidoptera insects. Bacillus thuringiensis serovar alesti was used to control caterpillars from 1970s. Here we reported the complete genome of BGSC 4C1, the type strain of this serovar. It has a circular chromosome and six plasmids. The largest plasmid pBMB267 contains five insecticidal crystal protein genes (two copies of cry1Ae, cry1Gb, cry2Ab, and a novel cry1M-type gene) and three vegetative insecticidal protein genes (a novel binary toxin gene operon vip1-vip2 and vip3Aa). Besides, the strain also has many genes encodeing virulence factors, and some secondary metabolite biosynthetic gene clusters involved in synthesis of antimicrobial peptides and bacteriocins. In addition, there is a poly γ-glutamate synthesis gene cluster, whose product is a candidate to control inflammasome-mediated disorders and potential in many other fields. "
negative,"Expansion of LINEs and species-specific DNA repeats drives genome expansion in Asian Gypsy Moths. Two subspecies of Asian gypsy moth (AGM), Lymantria dispar asiatica and L. dispar japonica, pose a serious alien invasive threat to North American forests. Despite decades of research on the ecology and biology of this pest, limited AGM-specific genomic resources are currently available. Here, we report on the genome sequences and functional content of these AGM subspecies. The genomes of L.d. asiatica and L.d. japonica are the largest lepidopteran genomes sequenced to date, totaling 921 and 999 megabases, respectively. Large genome size in these subspecies is driven by the accumulation of specific classes of repeats. Genome-wide metabolic pathway reconstructions suggest strong genomic signatures of energy-related pathways in both subspecies, dominated by metabolic functions related to thermogenesis. The genome sequences reported here will provide tools for probing the molecular mechanisms underlying phenotypic traits that are thought to enhance AGM invasiveness. "
negative,"Caste development and reproduction: a genome-wide analysis of hallmarks of insect eusociality. The honey bee queen and worker castes are a model system for developmental plasticity. We used established expressed sequence tag information for a Gene Ontology based annotation of genes that are differentially expressed during caste development. Metabolic regulation emerged as a major theme, with a caste-specific difference in the expression of oxidoreductases vs. hydrolases. Motif searches in upstream regions revealed group-specific motifs, providing an entry point to cis-regulatory network studies on caste genes. For genes putatively involved in reproduction, meiosis-associated factors came out as highly conserved, whereas some determinants of embryonic axes either do not have clear orthologs (bag of marbles, gurken, torso), or appear to be lacking (trunk) in the bee genome. Our results are the outcome of a first genome-based initiative to provide an annotated framework for trends in gene regulation during female caste differentiation (representing developmental plasticity) and reproduction. "
negative,"Isolation and characterization of a genomic clone for the gene of an insect molting enzyme, chitinase. Genomic clones for a chitinolytic enzyme were isolated from a library of Sau 3A digested DNA from the tobacco hornworm, Manduca sexta, using a previously isolated chitinase cDNA clone as a probe [Kramer et al., Insect Biochem. Molec. Biol. 23, 691-701 (1993)]. Restriction enzyme mapping and Southern blot analysis of four genomic clones suggested that these are overlapping clones. Sequence analysis of the genomic clones and Southern blot analysis of total genomic DNA also suggest that the M. sexta genome has only one chitinase gene detectable by the cDNA probe. This gene is organized into at least 11 exons in a region spanning > 11 kb. The sequenced M. sexta chitinase gene has a series of exons corresponding to identifiable structural / functional regions of the protein. Similarities in structure and organization between the M. sexta chitinase gene and chitinase genes from other sources are described. "
negative,"The genomics of insecticide resistance: insights from recent studies in African malaria vectors. Over 80% of the world's population is at risk from arthropod-vectored diseases, and arthropod crop pests are a significant threat to food security. Insecticides are our front-line response for controlling these disease vectors and pests, and consequently the increasing prevalence of insecticide resistance is of global concern. Here we provide a brief overview of how genomics can be used to implement effective insecticide resistance management (IRM), with a focus on recent advances in the study of Anopheles gambiae, the major vector of malaria in Africa. These advances unlock the potential for a predictive form of IRM, allowing tractable feedback for stakeholders, where the latest field data and well parameterised models can maximise the lifetime and effectiveness of available insecticides. "
negative,"Chromosomal deletions mediated by CRISPR / Cas9 in Helicoverpa armigera. Helicoverpa armigera, cotton bollworm, is one of the most disastrous pests worldwide, threatening various food and economic crops. Functional genomic tools may provide efficient approaches for its management. The clustered regularly interspaced short palindromic repeats (CRISPR) / CRISPR-associated protein 9 (Cas9) system, dependent on a single guide RNA (sgRNA), has been used to induce indels for targeted mutagenesis in cotton bollworm. However, genomic deletions may be more desirable to disrupt the function of noncoding genes or regulatory sequences. By injecting two sgRNAs with Cas9 protein targeting different exons, we obtained predictable genomic deletions of several hundred bases. We achieved this type of modification with different combinations of sgRNA pairs, including HaCad and HaABCC2. Our finding indicated that CRISPR / Cas9 can be used as an efficient tool to engineer genomes with chromosomal deletion in H. armigera. "
negative,"Disease vectors in the era of next generation sequencing. Almost 20 % of all infectious human diseases are vector borne and, together, are responsible for over one million deaths per annum. Over the past decade, the decreasing costs of massively parallel sequencing technologies have facilitated the agnostic interrogation of insect vector genomes, giving medical entomologists access to an ever-expanding volume of high-quality genomic and transcriptomic data. In this review, we highlight how genomics resources have provided new insights into the physiology, behavior, and evolution of human disease vectors within the context of the global health landscape. "
negative,"Rapid evolution in insect pests: the importance of space and time in population genomics studies. Pest species in agroecosystems often exhibit patterns of rapid evolution to environmental and human-imposed selection pressures. Although the role of adaptive processes is well accepted, few insect pests have been studied in detail and most research has focused on selection at insecticide resistance candidate genes. Emerging genomic datasets provide opportunities to detect and quantify selection in insect pest populations, and address long-standing questions about mechanisms underlying rapid evolutionary change. We examine the strengths of recent studies that stratify population samples both in space (along environmental gradients and comparing ancestral vs. derived populations) and in time (using chronological sampling, museum specimens and comparative phylogenomics), resulting in critical insights on evolutionary processes, and providing new directions for studying pests in agroecosystems. "
negative,"Genomic data reveal high conservation but divergent evolutionary pattern of Polycomb / Trithorax group genes in arthropods. Epigenetic gene control is maintained by chromatin-associated Polycomb group (PcG) and Trithorax group (TrxG) genes, which act antagonistically via the interplay between PcG and TrxG regulation to generate silenced or permissive transcriptional states. In this study, we searched for PcG / TrxG genes in 180 arthropod genomes, covering all the sequenced arthropod genomes at the time of conducting this study, to perform a global investigation of PcG / TrxG genes in a phylogenetic frame. Results of ancestral state reconstruction analysis revealed that the ancestor of arthropod species has an almost complete repertoire of PcG / TrxG genes, and most of these genes were seldom lost above order level. The domain diversity analysis indicated that the PcG / TrxG genes show variable extent of domain structure changes; some of these changes could be associated with lineage-specific events. The likelihood ratio tests for selection pressure detected a number of PcG / TrxG genes which underwent episodic positive selection on the branch leading to the insects with holometabolous development. These results suggest that, despite their high conservation across arthropod species, different members of PcG / TrxG genes showed considerable differences in domain structure and sequence divergence in arthropod evolution. Our cross species comparisons using large-scale genomic data provide insights into divergent evolutionary pattern on highly conserved genes in arthropods. "
negative,"Implication for DNA methylation involved in the host transfer of diamondback moth, Plutella xylostella (L.). DNA methylation exerts extensive impacts on gene expression of various living organisms exposed to environmental variation. However, little is known whether DNA methylation is involved in the host transfer of diamondback moth, Plutella xylostella (L.), a worldwide destructive pest of crucifers. In this study, we found that P. xylostella genome exhibited a relatively low level of DNA methylation on the basis of the CpG O / E prediction and experimental validation. A significant positive linear correlation was observed between the stage-specific expressions of PxDNMT1 and DNA methylation levels (5mC content). Particularly, high levels of DNA methylation and gene expression of PxDNMT1 were observed in eggs and mature females of P. xylostella. After host transfer of P. xylostella from Raphanus sativus to Arabidopsis thaliana, we identified some potential genomic loci that might have changed methylation levels. Using the method of fluorescence-labeled methylation-sensitive amplified polymorphism (F-MSAP), we also found the corresponding genes primarily involved in neural system and signaling. The expressions of six candidate genes were verified by qRT-PCR. One of the genes, Px009600, might be regulated by a DNA methylation-mediated mechanism in response to host transfer. Our study provides evidence for a functional system of DNA methylation in P. xylostella and its possible role in adaptation during host transfer. Further studies should examine methylation as responsive factors to different host plants and environmental cues in insect pests. "
positive,"Biochemical characterization of three midgut chitin deacetylases of the Lepidopteran insect Bombyx mori. Peritrophic membrane (PM) is a chitin and protein-containing extracellular matrix that lines the midgut in most insect species, functioning as a barrier to exogenous toxins and pathogens. Midgut chitin deacetylases (CDAs) are chitin-modifying enzymes known to alter the mechanical property and permeability of PM. However, biochemical properties and specific roles of these enzymes remain elusive. In this study, the midgut-expressed CDAs (BmCDA6, BmCDA7 and BmCDA8) from Bombyx mori were cloned, recombinantly expressed and purified and their enzymatic activities toward PM chitin were determined. Of the three enzymes, BmCDA7 exhibited the highest activity (0.284 μmol / min / μmol), while BmCDA8 showed lower activity of 0.061 μmol / min / μmol. BmCDA6 was inactive towards PM chitin. Gene expression patterns indicated that although all three CDA genes were specifically expressed in the anterior midgut, they differed in their temporal expression patterns. BmCDA6 was expressed almost exclusively at the mid-molt stage, the stage when the PM was thick and with multiple chitin layers. Unlike BmCDA6, high expression levels of BmCDA7 and BmCDA8 were observed only at the feeding stage, the stage when the PM is thin and with fewer chitin layers. The different gene expression patterns and biochemical characteristics provide new information about the functional specialization among BmCDA6, BmCDA7 and BmCDA8 proteins. "
positive,"The cys-loop ligand-gated ion channel gene superfamily of the parasitoid wasp, Nasonia vitripennis. Members of the cys-loop ligand-gated ion channel (cysLGIC) superfamily mediate chemical neurotransmission and are studied extensively as potential targets of drugs used to treat neurological disorders, such as Alzheimer's disease. Insect cys-loop LGICs also have central roles in the nervous system and are targets of highly successful insecticides. Here, we describe the cysLGIC superfamily of the parasitoid wasp, Nasonia vitripennis, which is emerging as a highly useful model organism and is deployed as a biological control of insect pests. The wasp superfamily consists of 26 genes, which is the largest insect cysLGIC superfamily characterized, whereas Drosophila melanogaster, Apis mellifera and Tribolium castaneum have 23, 21 and 24, respectively. As with Apis, Drosophila and Tribolium, Nasonia possesses ion channels predicted to be gated by acetylcholine, gamma-amino butyric acid, glutamate and histamine, as well as orthologues of the Drosophila pH-sensitive chloride channel (pHCl), CG8916 and CG12344. Similar to other insects, wasp cysLGIC diversity is broadened by alternative splicing and RNA A-to-I editing, which may also serve to generate species-specific receptor isoforms. These findings on N. vitripennis enhance our understanding of cysLGIC functional genomics and provide a useful basis for the study of their function in the wasp model, as well as for the development of improved insecticides that spare a major beneficial insect species. "
negative,"Comparative genomics of insect-symbiotic bacteria: influence of host environment on microbial genome composition. Commensal symbionts, thought to be intermediary amid obligate mutualists and facultative parasites, offer insight into forces driving the evolutionary transition into mutualism. Using macroarrays developed for a close relative, Escherichia coli, we utilized a heterologous array hybridization approach to infer the genomic compositions of a clade of bacteria that have recently established symbiotic associations: Sodalis glossinidius with the tsetse fly (Diptera, Glossina spp.) and Sitophilus oryzae primary endosymbiont (SOPE) with the rice weevil (Coleoptera, Sitophilus oryzae). Functional biologies within their hosts currently reflect different forms of symbiotic associations. Their hosts, members of distant insect taxa, occupy distinct ecological niches and have evolved to survive on restricted diets of blood for tsetse and cereal for the rice weevil. Comparison of genome contents between the two microbes indicates statistically significant differences in the retention of genes involved in carbon compound catabolism, energy metabolism, fatty acid metabolism, and transport. The greatest reductions have occurred in carbon catabolism, membrane proteins, and cell structure-related genes for Sodalis and in genes involved in cellular processes (i.e., adaptations towards cellular conditions) for SOPE. Modifications in metabolic pathways, in the form of functional losses complementing particularities in host physiology and ecology, may have occurred upon initial entry from a free-living to a symbiotic state. It is possible that these adaptations, streamlining genomes, act to make a free-living state no longer feasible for the harnessed microbe. "
negative,"Body lice and head lice (Anoplura: Pediculidae) have the smallest genomes of any hemimetabolous insect reported to date. The human body louse, Pediculus humanus humanus L. (Anoplura: Pediculidae), is a vector of several diseases, including louse-borne epidemic typhus, relapsing fever, and trench fever, whereas the head louse, Pediculus humanus capitis De Geer (Anoplura: Pediculidae), is more a pest of social concern. Sequencing of the body louse genome has recently been proposed and undertaken by National Human Genome Research Institute. One of the first steps in understanding an organism's genome is to determine its genome size. Here, using flow cytometry determinations, we present evidence that body louse genome size is 104.7 + / - 1.4 Mb for females and 108.3 + / - 1.1 Mb for males. Our results suggest that head lice also have a small genome size, of similar size to the body louse. Thus, Pediculus lice have one of the smallest genome sizes known in insects, suggesting it may be a suitable choice as a minimal hemimetabolous genome. "
positive,"Expression of a novel member of the odorant-binding protein gene family in Culex nigripalpus (Diptera: Culicidae). We previously showed that gene expression in the midgut of female Culex nigripalpus Theobald (Diptera: Culicidae) was altered after ingestion of a bloodmeal and some of the expressed cDNAs showed stage-, sex-, and tissue-specific expression. One of these expressed cDNAs, CN G11B, is here shown to be similar to members of a gene family that encodes odorant-binding proteins. CN G11B.1 is a cDNA fragment of 721 bp, is incomplete at the 5'-end, and contains a canonical polyadenylic acid tail signal sequence in the 103-bp 3'-untranslated region. Translation of CN G11B.1 provides a putative protein product of 207 amino acids. GenBank tblastx, VectorBase, and Pfam database searches showed identity to hypothetical proteins from Culex pipiens quinquefasciatus Say (86%) and Aedes aegypti (L.) (55%). These proteins have structural motifs similar to those found in the gene family that includes odorant-binding proteins. CN G11B.1 putative protein has two of the six cysteines that are highly conserved in most invertebrate odorant-binding proteins. CN G11B.1 expression increased in thoraces (6-12 h) and in abdomens (3-48 h) of blood fed female Cx. nigripalpus but was not detected in RNA from heads, indicating a possible role in both chemoreception and blood feeding. "
positive,"Molecular diversity of PBAN family peptides from fire ants. The PBAN / Pyrokinin peptide family is a major neuropeptide family characterized with a common FXPRLamide in the C-termini. These peptides are ubiquitously distributed in the Insecta and are involved in many essential endocrinal functions, e.g., pheromone production. Previous work demonstrated the localization of PBAN in the fire ant central nervous system, and identified a new family of PBAN from the red imported fire ant, Solenopsis invicta. In this study, we identified five more PBAN / Pyrokinin genes from S. geminata, S. richteri, S. pergandii, S. carolinensis, and a hybrid of S. invicta and S. richteri. The gene sequences were used to determine the phylogenetic relationships of these species and hybrid, which compared well to the morphologically defined fire ant subgroup complexes. The putative PBAN and other peptides were determined from the amino acid sequences of the PBAN / pyrokinin genes. We summarized all known insect PBAN family neuropeptides, and for the first time constructed a phylogenetic tree based on the full amino acid sequences translated from representative PBAN cDNAs. The PBAN / pyrokinin gene is well conserved in Insecta and probably extends into the Arthropod phylum; however, translated pre-propeptides may vary and functional diversity may be retained, lost, or modified during the evolutionary process. "
negative,"Transient expression of a promoter-reporter construct in differentiated adult salivary glands and embryos of the mosquito Aedes aegypti. Vector-borne pathogens develop in close association with specific tissues in their insect hosts. Efforts are being made to characterize insect genes that are expressed in tissues that have important roles in pathogen propagation. Successful transfection and expression of exogenous genes in terminally differentiated tissues of insects has previously proven difficult. Here we report a method that should allow the analysis of genes that are expressed in adult tissues and organs. Transient expression assays have been developed using the salivary glands of the mosquito, Aedes aegypti, which can now be used to analyze salivary gland-specific promoter sequences. A liposome-based transfection reagent was used to transfect cultured adult salivary glands with a DNA construct carrying the luciferase reporter gene under the control of the Drosophila melanogaster heat shock 70 promoter. Luciferase activity was detected in glands 18-20 hr post-transfection. This assay can now be used to determine the regulatory activity of other putative promoter sequences from salivary gland-specific genes. Alternatively, the assay may be used to study the effect of recombinant gene expression on parasite invasion and development. In addition, transient expression of gene constructs in embryos is shown to be a powerful tool for analyzing genes that are expressed at this stage of the mosquito life cycle. "
positive,"Rh6 gene modulates the visual mechanism of host utilization in fruit fly Bactrocera minax. BACKGROUND: Vision plays a critical role in host location and oviposition behavior for herbivorous insects. However, the molecular mechanisms underlying visual regulation in host recognition and oviposition site selection in insects remains unknown. The aim of this study was to explore the key visual genes that are linked to the host plant location of the fruit fly, Bactrocera minax. RESULTS: Using a host specialist fruit fly, B. minax, which lays eggs only into immature green citrus fruit, we undertook behavioral, transcriptomic, and RNAi research to identify the molecular basis for host fruit color recognition. In laboratory and field assays we found that adults prefer green over other colors, and this preference is significantly increased in sexually mature over immature flies. Furthermore, we identified that the Rh6 gene, responsible for green spectral sensitivity, has elevated expression in mature flies over immature flies. RNAi suppression of Rh6 eliminated the preference for green, resulting in a significant decrease in the number of eggs laid by B. minax in green unripe citrus. CONCLUSION: These results show that the Rh6 gene modulates the visual mechanism of host utilization in B. minax, providing a genetic basis for visual host location in a non-model insect herbivore. © 2018 Society of Chemical Industry. "
