category,text
negative,"An Anopheles stephensi Promoter-Trap: Augmenting Genome Annotation and Functional Genomics. The piggyBac transposon was modified to generate gene trap constructs, which were then incorporated into the genome of the Asian malaria vector, Anopheles stephensi and remobilized through genetic crosses using a piggyBac transposase expressing line. A total of 620 remobilization events were documented, and 73 were further characterized at the DNA level to identify patterns in insertion site preferences, remobilization frequencies, and remobilization patterns. Overall, the use of the tetameric AmCyan reporter as the fusion peptide displayed a preference for insertion into the 5'-end of transcripts. Notably 183 - 44882 bp upstream of the An. stephensi v1.0 ab initio gene models, which demonstrated that the promoter regions for the genes of An. stephensi are further upstream of the 5'-proximal regions of the genes in the ab inito models than may be otherwise predicted. RNA-Seq transcript coverage supported the insertion of the splice acceptor gene trap element into 5'-UTR introns for nearly half of all insertions identified. The use of a gene trap element that prefers insertion into the 5'-end of genes supports the use of this technology for the random generation of knock-out mutants, as well as the experimental confirmation of 5'-UTR introns in An. stephensi. "
positive,"Odorant reception in the malaria mosquito Anopheles gambiae. The mosquito Anopheles gambiae is the major vector of malaria in sub-Saharan Africa. It locates its human hosts primarily through olfaction, but little is known about the molecular basis of this process. Here we functionally characterize the Anopheles gambiae odorant receptor (AgOr) repertoire. We identify receptors that respond strongly to components of human odour and that may act in the process of human recognition. Some of these receptors are narrowly tuned, and some salient odorants elicit strong responses from only one or a few receptors, suggesting a central role for specific transmission channels in human host-seeking behaviour. This analysis of the Anopheles gambiae receptors permits a comparison with the corresponding Drosophila melanogaster odorant receptor repertoire. We find that odorants are differentially encoded by the two species in ways consistent with their ecological needs. Our analysis of the Anopheles gambiae repertoire identifies receptors that may be useful targets for controlling the transmission of malaria. "
negative,"Where the baculoviruses lead, the caterpillars follow: baculovirus-induced alterations in caterpillar behaviour. Baculoviruses are well-known for altering the behaviour of their caterpillar hosts by inducing hyperactivity (enhanced locomotion) and / or tree-top disease (climbing to elevated positions before death). These features, along with the genomic small size of baculoviruses compared to non-viral parasites and the at hand techniques for producing mutants, imply that baculoviruses are excellent tools for unravelling the molecular mechanisms underlying parasitic alteration of host behaviour. Baculoviruses can be easily mutated, allowing an optimal experimental setup in comparative studies, where for instance host gene expression can be compared between insects infected with wild-type viruses or with mutant viruses lacking genes involved in behavioural manipulation. Recent studies have revealed the first insight into the underlying molecular pathways that lead to the typical behaviour of baculovirus-infected caterpillars and into the role of light therein. Since host behaviour in general is mediated through the host's central nervous system (CNS), a promising future step will be to study how baculoviruses regulate the neuronal activity of the host. "
positive,"Hh signaling from de novo organizers drive lgl neoplasia in Drosophila epithelium. The Hedgehog (Hh) morphogen regulates growth and patterning. Since Hh signaling is also implicated in carcinogenesis, it is conceivable that de novo Hh-secreting organizers, if formed in association with oncogenic hit could be tumor-cooperative. Here we validate this hypothesis using the Drosophila model of cooperative epithelial carcinogenesis. We generate somatic clones with simultaneous loss of tumor suppressor, Lgl, and gain of the posterior compartment selector, Engrailed (En), known to induce synthesis of Hh. We show that lgl UAS-en clones in the anterior wing compartment trigger Hh signaling cascade via cross-talk with their Ci-expressing wild type cell neighbors. Hh-Dpp signaling from clone boundaries of such ectopically formed de novo organizers in turn drive lgl carcinogenesis. By contrast, Ci-expressing lgl clones transform by autocrine and / or juxtracine activation of Hh signaling in only the posterior compartment. We further show that sequestration of the Hh ligand or loss of Dpp receptor, Tkv, in these Hh-sending or -receiving lgl clones arrested their carcinogenesis. Our results therefore reveal a hitherto unrecognized mechanism of tumor cooperation by developmental organizers, which are induced fortuitously by oncogenic hits. "
negative,"Identification of ion channel genes in the Acyrthosiphon pisum genome. Aphids are major pests of crops, causing hundreds of millions of dollars worth of damage annually. Ion channel proteins are often the targets of modern insecticides and mutations in ion channel genes can lead to resistance to many leading classes of insecticides. The sequencing of the pea aphid, Acyrthosiphon pisum, genome has now allowed detailed in silico analysis of the aphid ion channels. The study has revealed significant differences in the composition of the ion channel families between the aphid and other insects. For example A. pisum does not appear to contain a homologue of the nACh receptor alpha 5 gene whilst the calcium channel beta subunit has been duplicated. These variations could result in differences in function or sensitivity to insecticides. The genome sequence will allow the study of aphid ion channels to be accelerated, leading to a better understanding of the function of these economically important channels. The potential for identifying novel insecticide targets within the aphid is now a step closer. "
positive,"Comparative analysis of C-type lectin domain proteins in the ghost moth, Thitarodes xiaojinensis (Lepidoptera: Hepialidae). Insects have a large family of C-type lectins involved in cell adhesion, pathogen recognition and activation of immune responses. In this study, 32 transcripts encoding C-type lectin domain proteins (CTLDPs) were identified from the Thitarodes xiaojinensis transcriptome. According to their domain structures, six CTLDPs with one carbohydrate-recognition domain (CRD) were classified into the CTL-S subfamily. The other 23 CTLDPs with two CRDs were grouped into the immulectin (IML) subfamily. The remaining three with extra regulatory domains were sorted into the CTL-X subfamily. Phylogenetic analysis showed that CTL-S and CTL-X members from different insects could form orthologous groups. In contrast, no T. xiaojinensis IML orthologues were found in other insects. Remarkable lineage-specific expansion in this subfamily was observed reflecting that these CTLDPs, as important receptors, have evolved diversified members in response to a variety of microbes. Prediction of binding ligands revealed that T. xiaojinensis, a cold-adapted species, conserved the ability of CRDs to combine with Ca2+ to keep its receptors from freezing. Comparative analysis of induction of CTLDP genes after different immune challenges indicated that IMLs might play critical roles in immune defenses. This study examined T. xiaojinensis CTLDPs and provides a basis for further studies of their characteristics. "
negative,"Transcriptomic study of the red palm weevil Rhynchophorus ferrugineus embryogenesis. The red palm weevil (RPW), Rhynchophorus ferrugineus (Coleoptera: Curculionidae), is an invasive, concealed and destructive tissue borer, and it becomes a lethal pest of the palm family of plants and has been reported to attack 20 palm species around the globe. Here we report a systematic transcriptomic study on embryogenesis of RPW, where we analyze the transcriptomes across five developmental stages of RPW embryogenesis, involving four embryonic stages (E1, E2, E3 and E4) and one larval stage (L1). Using the RNA-seq and next-generation platforms, we generated 80 to 91 million reads for each library and assemble 22 532 genes that are expressed at different embryonic stages. Among the total transcripts from the five embryonic development stages, we found that 30.45 % are differentially expressed, 10.10 % show stage-specificity and even a larger fraction, 62.88 %, exhibit constitutive expression in all the stages. We also analyzes the expression dynamics of several conserved signaling pathways (such as Hedgehog, JAK-STAT, Notch, TGF-β, Ras / MAPK and Wnt), as well as key developmental genes, including those related to apoptosis, axis formation, Hox complex, neurogenesis and segmentation. The datasets provide an essential resource for gene annotation and RPW functional genomics, including studies by using tools and concepts from multiple disciplines, such as development, physiology, biochemistry, molecular biology and genetics.  "
negative,"A genome-wide survey of small interfering RNA and microRNA pathway genes in a galling insect. Deployment of resistance (R) genes is the most effective control for Hessian fly, Mayetiola destructor (Say); however, deployment of R genes results in an increased frequency of pest genotypes that display virulence to them. RNA interference (RNAi) is a useful reverse genetics tool for studying such insect virulence pathways, but requires a systemic phenotype, which is not found in all species. In an effort to correlate our observed weak RNAi phenotype in M. destructor with a genetic basis, we have aggregated and compared RNAi related genes across M. destructor, three other insect species, and the nematode Caenorhabditis elegans. We report here the annotation of the core genes in the small interfering RNA (siRNA) and microRNA (miRNA) pathways in M. destructor. While most of the miRNA pathway genes were highly conserved across the species studied, the siRNA pathway genes showed increased relative variability in comparison to the miRNA pathway. In particular, the Piwi / Argonaute / Zwille (PAZ) domain of Dicer-2 (DCR-2) had the least amount of sequence similarity of any domain among species surveyed, with a trend of increased conservation in those species with amenable systemic RNAi. A homolog of the systemic interference defective-1 (Sid-1) gene of C. elegans was also not annotated in the M. destructor genome. Indeed, it is of interest that a Sid-1 homolog has not been detected in any dipteran species to date. We hypothesize the sequence architecture of the PAZ domain in the M. destructor DCR-2 protein is related to reduced efficacy of this enzyme and this taken together with the lack of a Sid-1 homolog may account for the weak RNAi response observed to date in this species as well as other dipteran species. "
negative,"BmiGI: a database of cDNAs expressed in Boophilus microplus, the tropical / southern cattle tick. We used an expressed sequence tag approach to initiate a study of the genome of the southern cattle tick, Boophilus microplus. A normalized cDNA library was synthesized from pooled RNA purified from tick larvae which had been subjected to different treatments, including acaricide exposure, heat shock, cold shock, host odor, and infection with Babesia bovis. For the acaricide exposure experiments, we used several strains of ticks, which varied in their levels of susceptibility to pyrethroid, organophosphate and amitraz. We also included RNA purified from samples of eggs, nymphs and adult ticks and dissected tick organs. Plasmid DNA was prepared from 11,520 cDNA clones and both 5' and 3' sequencing performed on each clone. The sequence data was used to search public protein databases and a B. microplus gene index was constructed, consisting of 8270 unique sequences whose associated putative functional assignments, when available, can be viewed at the TIGR website (http: /  / www.tigr.org / tdb / tgi). A number of novel sequences were identified which possessed significant sequence similarity to genes, which might be involved in resistance to acaricides. "
positive,"Egf-like gene is essential for cuticle metabolism in the brown planthopper. Using the mass spectrometry analysis of cuticle casts of brown planthopper (BPH, Nilaparvata lugens) and transcriptome analysis of BPH tissues, we identified a gigantic gene (50,922 bp, 16,973 aa) tentatively called Nlegf-like. Multiple transcripts were found. Nlegf-like encodes an integral membrane protein of 16,973 amino acid residues with 260 EGF-like repeats and 16 Ca2+-binding EGF repeats type (cbEGFs) in the extracellular portion. Nlegf-like was highly expressed in the integument and tended to peak at the middle stage or late stage of each nymph instar. Phylogenetic analysis showed this gene is conserved in many other insects. Different double-stranded RNA-mediated RNA interference targeting eight different regions of the Nlegf-like gene resulted in abnormal cuticle formation or molting and lethal phenotypes. Transmission electron microscopy revealed that the newly formed endocuticle was significantly thinner for RNAi-treated BPHs with phenotype of contracted abdomen, or the old cuticle could not be digested sufficiently for those with phenotype of slender body shape or died with molting difficulty when compared with the control group. We suggest that the Nlegf-like is crucial for metabolism of the cuticle in BPH molting. "
negative,"The complete mitochondrial genome of the rice moth, Corcyra cephalonica. The complete mitochondrial genome (mitogenome) of the rice moth, Corcyra cephalonica Stainton (Lepidoptera: Pyralidae) was determined as a circular molecular of 15,273 bp in size. The mitogenome composition (37 genes) and gene order are the same as the other lepidopterans. Nucleotide composition of the C. cephalonica mitogenome is highly A+T biased (80.43%) like other insects. Twelve protein-coding genes start with a typical ATN codon, with the exception of coxl gene, which uses CGA as the initial codon. Nine protein-coding genes have the common stop codon TAA, and the nad2, cox1, cox2, and nad4 have single T as the incomplete stop codon. 22 tRNA genes demonstrated cloverleaf secondary structure. The mitogenome has several large intergenic spacer regions, the spacer1 between trnQ gene and nad2 gene, which is common in Lepidoptera. The spacer 3 between trnE and trnF includes microsatellite-like repeat regions (AT)18 and (TTAT)(3). The spacer 4 (16 bp) between trnS2 gene and nad1 gene has a motif ATACTAT; another species, Sesamia inferens encodes ATCATAT at the same position, while other lepidopteran insects encode a similar ATACTAA motif. The spacer 6 is A+T rich region, include motif ATAGA and a 20-bp poly(T) stretch and two microsatellite (AT)(9), (AT)(8) elements. "
negative,"Genomic analysis of ""Elusimicrobium minutum,"" the first cultivated representative of the phylum ""Elusimicrobia"" (formerly termite group 1). Organisms of the candidate phylum termite group 1 (TG1) are regularly encountered in termite hindguts but are present also in many other habitats. Here, we report the complete genome sequence (1.64 Mbp) of ""Elusimicrobium minutum"" strain Pei191(T), the first cultured representative of the TG1 phylum. We reconstructed the metabolism of this strictly anaerobic bacterium isolated from a beetle larva gut, and we discuss the findings in light of physiological data. E. minutum has all genes required for uptake and fermentation of sugars via the Embden-Meyerhof pathway, including several hydrogenases, and an unusual peptide degradation pathway comprising transamination reactions and leading to the formation of alanine, which is excreted in substantial amounts. The presence of genes encoding lipopolysaccharide biosynthesis and the presence of a pathway for peptidoglycan formation are consistent with ultrastructural evidence of a gram-negative cell envelope. Even though electron micrographs showed no cell appendages, the genome encodes many genes putatively involved in pilus assembly. We assigned some to a type II secretion system, but the function of 60 pilE-like genes remains unknown. Numerous genes with hypothetical functions, e.g., polyketide synthesis, nonribosomal peptide synthesis, antibiotic transport, and oxygen stress protection, indicate the presence of hitherto undiscovered physiological traits. Comparative analysis of 22 concatenated single-copy marker genes corroborated the status of ""Elusimicrobia"" (formerly TG1) as a separate phylum in the bacterial domain, which was so far based only on 16S rRNA sequence analysis. "
negative,"Functional consequences of mutations in the Drosophila histamine receptor HCLB. The gene hclB encodes a histamine-gated chloride channel subunit in Drosophila melanogaster. Mutations in hclB lead to defects in the visual system and altered sensitivity to the action of ivermectin. To investigate whether this member of the Cys-loop receptors is common across the Insecta, we analysed the genomes of seven other insect species (Diptera, Hymenoptera, Coleoptera) and revealed orthologues of hclB in all of them. Sequence comparisons showed high identity levels between the orthologues, indicating similar constraints and conserved function between the species. Two D. melanogaster mutants, hclB(T1) (P293S) and hclB(T2) (W111*, a null mutation) were tested for the lapse into, and recovery from, paralysis induced by high temperature or the anaesthetic action of halothane. At 41 degrees C, the hclB(T2) flies lapsed into coma faster than wild-type or the hclB(T1) flies, while both mutants recovered more slowly. A substantially impaired recovery rate was also observed in hclB(T1) after anaesthesia with halothane. Enhanced synaptic signalling at low-intensity light stimuli was registered on electroretinograms recorded from the two mutant strains. Our results suggest that HCLB may play an essential and conserved role in insect neurophysiology. "
negative,"Applications of genome editing in insects. Insect genome editing was first reported 1991 in Drosophila melanogaster but the technology used was not portable to other species. Not until the recent development of facile, engineered DNA endonuclease systems has gene editing become widely available to insect scientists. Most applications in insects to date have been technical in nature but this is rapidly changing. Functional genomics and genetics-based insect control efforts will be major beneficiaries of the application of contemporary gene editing technologies. Engineered endonucleases like Cas9 make it possible to create powerful and effective gene drive systems that could be used to reduce or even eradicate specific insect populations. 'Best practices' for using Cas9-based editing are beginning to emerge making it easier and more effective to design and use but gene editing technologies still require traditional means of delivery in order to introduce them into somatic and germ cells of insects-microinjection of developing embryos. This constrains the use of these technologies by insect scientists. Insects created using editing technologies challenge existing governmental regulatory structures designed to manage genetically modified organisms. "
negative,"Comparative analysis of serine protease-related genes in the honey bee genome: possible involvement in embryonic development and innate immunity. We have identified 44 serine protease (SP) and 13 serine protease homolog (SPH) genes in the genome of Apis mellifera. Most of these genes encode putative secreted proteins, but four SPs and three SPHs may associate with the plasma membrane via a transmembrane region. Clip domains represent the most abundant non-catalytic structural units in these SP-like proteins -12 SPs and six SPHs contain at least one clip domain. Some of the family members contain other modules for protein-protein interactions, including disulphide-stabilized structures (LDL(r)A, SRCR, frizzled, kringle, Sushi, Wonton and Pan / apple), carbohydrate-recognition domains (C-type lectin and chitin-binding), and other modules (such as zinc finger, CUB, coiled coil and Sina). Comparison of the sequences with those from Drosophila led to a proposed SP pathway for establishing the dorsoventral axis of honey bee embryos. Multiple sequence alignments revealed evolutionary relationships of honey bee SPs and SPHs with those in Drosophila melanogaster, Anopheles gambiae, and Manduca sexta. We identified homologs of D. melanogaster persephone, M. sexta HP14, PAP-1 and SPH-1. A. mellifera genome includes at least five genes for potential SP inhibitors (serpin-1 through -5) and three genes of SP putative substrates (prophenoloxidase, spätzle-1 and spätzle-2). Quantitative RT-PCR analyses showed an elevation in the mRNA levels of SP2, SP3, SP9, SP10, SPH41, SPH42, SP49, serpin-2, serpin-4, serpin-5, and spätzle-2 in adults after a microbial challenge. The SP41 and SP6 transcripts significantly increased after an injection of Paenibacillus larva, but there was no such increase after injection of saline or Escherichia coli. mRNA levels of most SPs and serpins significantly increased by 48 h after the pathogen infection in 1st instar larvae. On the contrary, SP1, SP3, SP19 and serpin-5 transcript levels reduced. These results, taken together, provide a framework for designing experimental studies of the roles of SPs and related proteins in embryonic development and immune responses of A. mellifera. "
negative,"Whole transcriptome responses among females of the filariasis and arbovirus vector mosquito Culex pipiens implicate TGF-β signaling and chromatin modification as key drivers of diapause induction. Culex pipiens mosquitoes are important disease vectors inhabiting temperate zones, worldwide. The seasonal reduction in temperature and photoperiod accompanying late summer and early fall prompts female mosquitoes to enter diapause, a stage of developmental arrest and physiological conditioning that enhances survival during the winter months. To investigate the molecular mechanisms underlying diapause induction, we used custom whole transcriptome microarrays to identify differences in gene expression following exposure to nondiapause (long days, 25 °C) and diapause-inducing (short days, 18 °C) environmental conditions. Using a two-way ANOVA, we identified 1130 genes that were differentially expressed. We used the expression of these genes across three time points to construct a gene co-expression network comprising five modules. Genes in modules 1, 2, and 3 were largely up-regulated, while genes in modules 4 and 5 were down-regulated when compared to nondiapause conditions. Pathway enrichment analysis of the network modules revealed some potential regulatory mechanisms driving diapause induction. Module 1 was enriched for genes in the TGF-ß and Wnt signaling pathways; module 2 was enriched for genes involved in insect hormone biosynthesis, specifically, ecdysone synthesis; module 3 was enriched for genes involved in chromatin modification; and module 5 was enriched for genes in the circadian rhythm pathway. Our results suggest that TGF-β signaling and chromatin modification are key drivers for the integration of environmental signals into the diapause induction phase in C. pipiens mosquitoes. "
negative,"Complete DNA sequence of Kuraishia capsulata illustrates novel genomic features among budding yeasts (Saccharomycotina). The numerous yeast genome sequences presently available provide a rich source of information for functional as well as evolutionary genomics but unequally cover the large phylogenetic diversity of extant yeasts. We present here the complete sequence of the nuclear genome of the haploid-type strain of Kuraishia capsulata (CBS1993(T)), a nitrate-assimilating Saccharomycetales of uncertain taxonomy, isolated from tunnels of insect larvae underneath coniferous barks and characterized by its copious production of extracellular polysaccharides. The sequence is composed of seven scaffolds, one per chromosome, totaling 11.4 Mb and containing 6,029 protein-coding genes, ~13.5% of which being interrupted by introns. This GC-rich yeast genome (45.7%) appears phylogenetically related with the few other nitrate-assimilating yeasts sequenced so far, Ogataea polymorpha, O. parapolymorpha, and Dekkera bruxellensis, with which it shares a very reduced number of tRNA genes, a novel tRNA sparing strategy, and a common nitrate assimilation cluster, three specific features to this group of yeasts. Centromeres were recognized in GC-poor troughs of each scaffold. The strain bears MAT alpha genes at a single MAT locus and presents a significant degree of conservation with Saccharomyces cerevisiae genes, suggesting that it can perform sexual cycles in nature, although genes involved in meiosis were not all recognized. The complete absence of conservation of synteny between K. capsulata and any other yeast genome described so far, including the three other nitrate-assimilating species, validates the interest of this species for long-range evolutionary genomic studies among Saccharomycotina yeasts. "
